Description,Scientific Name,Max Score,Total Score,Query Cover,E value,Per. ident,Acc. Len,Accession  
"Pseudophaeobacter arcticus DSM 23566 Phaar_neu_scaffold_2516677464.1, whole genome shotgun sequence",Pseudophaeobacter arcticus DSM 23566,233,233,89%,3.00E-67,47.08,4215469,NZ_KI421507.1
"Donghicola tyrosinivorans strain DSM 100212 Ga0181042_103, whole genome shotgun sequence",Donghicola tyrosinivorans,233,233,90%,3.00E-67,45.56,451619,NZ_PVTQ01000003.1
"Aestuariivita boseongensis strain BS-B2 contig9, whole genome shotgun sequence",Aestuariivita boseongensis,233,233,90%,3.00E-67,45.35,102950,NZ_JXYH01000009.1
"Ensifer glycinis strain CCBAU 23380 scaffold20, whole genome shotgun sequence",Ensifer glycinis,233,233,90%,3.00E-67,43.24,461421,NZ_LPUX01000060.1
"Octadecabacter temperatus strain SB1 chromosome, complete genome",Octadecabacter temperatus,233,233,90%,3.00E-67,48.65,3233068,NZ_CP012160.1
"Actibacterium pelagium strain JN33 JN33_S4_979015bp, whole genome shotgun sequence",Actibacterium pelagium,233,233,90%,3.00E-67,45.56,979015,NZ_NSBU01000004.1
"Sagittula marina strain DSM 102235 Ga0373267_01, whole genome shotgun sequence",Sagittula marina,233,233,91%,3.00E-67,46.74,702663,NZ_JACIEJ010000001.1
"Stappia stellulata DSM 5886 G572DRAFT_scaffold00005.5_C, whole genome shotgun sequence",Stappia stellulata DSM 5886,233,233,90%,3.00E-67,44.27,470593,NZ_AUIM01000011.1
"Planktotalea arctica strain IMCC9565 9565_1_(paired)_trimmed_(paired)_contig_5, whole genome shotgun sequence",Planktotalea arctica,233,233,90%,3.00E-67,46.33,549703,NZ_MUHR01000005.1
"Phreatobacter stygius strain KCTC 52518 chromosome, complete genome",Phreatobacter stygius,233,233,90%,3.00E-67,44.79,7354671,NZ_CP039690.1
"Nereida ignava DSM 16309, whole genome shotgun sequence",Nereida ignava DSM 16309,233,233,90%,3.00E-67,46.72,363257,NZ_FORZ01000001.1
"Donghicola eburneus strain DSM 29127, whole genome shotgun sequence",Donghicola eburneus,233,233,90%,3.00E-67,45.56,422209,NZ_FOXY01000004.1
"Methylorubrum populi strain YC-XJ1 chromosome, complete genome",Methylorubrum populi,233,295,90%,3.00E-67,44.4,5395646,NZ_CP039546.1
"Puniceibacterium confluentis strain JSSK-17 52765_scaffold1, whole genome shotgun sequence",Puniceibacterium confluentis,233,233,90%,3.00E-67,46.33,559637,NZ_VOJI01000001.1
"Kiloniella spongiae strain MEBiC09566 contig6, whole genome shotgun sequence",Kiloniella spongiae,233,233,90%,3.00E-67,46.12,493299,NZ_LAQL01000006.1
"Alteriqipengyuania halimionae strain LMG 29519 NODE_1_length_2797261, whole genome shotgun sequence",Alteriqipengyuania halimionae,233,233,90%,3.00E-67,45.35,2797261,NZ_WTYR01000001.1
"Pseudodonghicola xiamenensis DSM 18339 G455DRAFT_scaffold00003.3_C, whole genome shotgun sequence",Pseudodonghicola xiamenensis DSM 18339,233,233,89%,3.00E-67,46.3,269965,NZ_AUBS01000003.1
"Lichenibacterium minor strain RmlP026 NODE_2_length_423874_cov_96.3956, whole genome shotgun sequence",Lichenibacterium minor,233,233,91%,3.00E-67,45.04,423874,NZ_QYBB01000002.1
"Microvirga massiliensis strain JC119, whole genome shotgun sequence",Microvirga massiliensis,233,233,90%,3.00E-67,44.4,1117146,NZ_LN811350.1
"Azorhizobium caulinodans ORS 571, complete sequence",Azorhizobium caulinodans ORS 571,233,285,91%,3.00E-67,43.63,5369772,NC_009937.1
"Luteovulum ovatum strain JA234, whole genome shotgun sequence",Luteovulum ovatum,233,233,90%,3.00E-67,46.72,277865,NZ_OAOQ01000004.1
"Altererythrobacter estronivorus strain MH-B5 contig5, whole genome shotgun sequence",Altererythrobacter estronivorus,233,233,89%,3.00E-67,45.91,353531,NZ_JRQQ01000005.1
"Marivita cryptomonadis strain CL-SK44 contig1, whole genome shotgun sequence",Marivita cryptomonadis,233,233,90%,3.00E-67,46.72,397937,NZ_JFKD01000001.1
"Hansschlegelia zhihuaiae strain S 113 Scaffold21, whole genome shotgun sequence",Hansschlegelia zhihuaiae,233,233,90%,3.00E-67,42.69,77251,NZ_RYFI01000021.1
"Sphingopyxis alaskensis RB2256, complete sequence",Sphingopyxis alaskensis RB2256,233,233,89%,3.00E-67,47.08,3345170,NC_008048.1
"Bombella apis strain MRM1 seq4, whole genome shotgun sequence",Bombella apis,233,233,88%,3.00E-67,48.03,284643,NZ_JADAQV010000004.1
"Methylobacterium bullatum strain LMG 24788 Methylo-24788_S1_L001_R1_001__paired__contig_111, whole genome shotgun sequence",Methylobacterium bullatum,233,233,90%,3.00E-67,46.72,51777,NZ_NKUG01000111.1
"Paraoceanicella profunda strain D4M1 chromosome, complete genome",Paraoceanicella profunda,233,233,90%,4.00E-67,45.56,4039866,NZ_CP040818.1
"Marivita lacus strain CGMCC 1.12478 sequence01, whole genome shotgun sequence",Marivita lacus,233,233,90%,4.00E-67,47.1,968185,NZ_BMFC01000001.1
"Thalassococcus halodurans strain DSM 26915, whole genome shotgun sequence",Thalassococcus halodurans,233,233,90%,4.00E-67,47.1,549042,NZ_FNUZ01000003.1
"Methyloferula stellata AR4 strain AR4T A3OQDRAFT_chromosome1.1_C, whole genome shotgun sequence",Methyloferula stellata AR4,233,290,91%,4.00E-67,43.02,4235448,NZ_ARWA01000001.1
"Seohaeicola zhoushanensis strain KCTC 42650 sequence01, whole genome shotgun sequence",Seohaeicola zhoushanensis,233,233,90%,4.00E-67,46.72,824170,NZ_BNCJ01000001.1
"Elioraea tepidiphila DSM 17972 F563DRAFT_scaffold00047.47, whole genome shotgun sequence",Elioraea tepidiphila DSM 17972,233,233,90%,4.00E-67,46.33,7390,NZ_KB899956.1
"Nitrobacter winogradskyi Nb-255, complete sequence",Nitrobacter winogradskyi Nb-255,233,361,90%,4.00E-67,43.85,3402093,NC_007406.1
"Aquabacter cavernae strain Sn-9-2 NODE_16, whole genome shotgun sequence",Aquabacter cavernae,233,233,90%,4.00E-67,45,244806,NZ_RWKV01000004.1
"Sphingomonas sanxanigenens DSM 19645 = NX02 chromosome, complete genome",Sphingomonas sanxanigenens DSM 19645 = NX02,233,349,90%,4.00E-67,48.64,6205897,NZ_CP006644.1
"Bradyrhizobium tropiciagri strain SEMIA 6148 contig00076, whole genome shotgun sequence",Bradyrhizobium tropiciagri,233,233,90%,4.00E-67,43.85,40170,NZ_LFLZ01000076.1
"Kaistia algarum strain LYH11 Pch-11_5, whole genome shotgun sequence",Kaistia algarum,233,233,90%,4.00E-67,43.89,301965,NZ_PSNV01000005.1
"Parasaccharibacter apium strain G7_7_3c chromosome, complete genome",Parasaccharibacter apium,233,233,88%,4.00E-67,48.03,2011634,NZ_CP020554.1
"Bradyrhizobium viridifuturi strain SEMIA 690 contig00015, whole genome shotgun sequence",Bradyrhizobium viridifuturi,233,233,90%,4.00E-67,43.85,168946,NZ_LGTB01000015.1
"Rickettsia heilongjiangensis strain Sendai-29 chromosome, complete genome",Rickettsia heilongjiangensis,233,233,90%,4.00E-67,44.4,1279369,NZ_AP019864.1
Rickettsia japonica strain M99123 chromosome,Rickettsia japonica,233,233,90%,4.00E-67,44.4,1283910,NZ_AP017600.1
"Nitrobacter vulgaris strain Ab1 NvAb1_26, whole genome shotgun sequence",Nitrobacter vulgaris,233,233,90%,4.00E-67,43.85,47696,NZ_MWPQ01000002.1
"Rhodoplanes roseus strain DSM 5909 NODE_59_length_27944_cov_32.1487, whole genome shotgun sequence",Rhodoplanes roseus,233,233,90%,4.00E-67,44.79,27944,NZ_NPEX01000059.1
"Martelella limonii strain NBRC 109441 NODE_12, whole genome shotgun sequence",Martelella limonii,233,233,90%,5.00E-67,43.63,140307,NZ_JABUOU010000012.1
"Methylobacterium crusticola strain MIMD6 contig103, whole genome shotgun sequence",Methylobacterium crusticola,233,233,90%,5.00E-67,45.21,30189,NZ_QOWC01000103.1
"Henriciella litoralis strain DSM 22014 DSM22014_S6_93, whole genome shotgun sequence",Henriciella litoralis,233,233,90%,5.00E-67,43.89,3042077,NZ_NCSS01000006.1
"Polymorphobacter multimanifer strain DSM 102189 Ga0373304_08, whole genome shotgun sequence",Polymorphobacter multimanifer,233,233,90%,5.00E-67,46.12,158993,NZ_JACIIV010000008.1
"Sphingopyxis bauzanensis strain DSM 22271 NODE_1_length_1336319_cov_55.7391, whole genome shotgun sequence",Sphingopyxis bauzanensis,233,284,90%,5.00E-67,45.91,1336319,NZ_NISK01000001.1
"Chelatococcus sambhunathii strain DSM 18167 DSM_18167_05, whole genome shotgun sequence",Chelatococcus sambhunathii,233,233,90%,5.00E-67,45.8,321457,NZ_LIOL01000005.1
"Sphingobium subterraneum strain DSM 102255 Ga0373363_02, whole genome shotgun sequence",Sphingobium subterraneum,233,233,89%,5.00E-67,47.47,787294,NZ_JACIJP010000002.1
"Sphingomonas jaspsi DSM 18422 G570DRAFT_scaffold00001.1, whole genome shotgun sequence",Sphingomonas jaspsi DSM 18422,233,233,89%,5.00E-67,46.69,2548011,NZ_KK073876.1
"Gluconobacter kanchanaburiensis NBRC 103587 sequence03, whole genome shotgun sequence",Gluconobacter kanchanaburiensis NBRC 103587,233,233,90%,5.00E-67,46.33,292714,NZ_BJVA01000003.1
"Bieblia vinaykumarii strain JA123, whole genome shotgun sequence",Bieblia vinaykumarii,233,233,90%,5.00E-67,47.88,183185,NZ_OBMN01000006.1
"Sphingomonas ginsengisoli An et al. 2013 strain KACC 16858 chromosome, complete genome",Sphingomonas ginsengisoli An et al. 2013,233,286,90%,5.00E-67,46.69,3037290,NZ_CP045434.1
"Marivita geojedonensis strain DPG-138 contig12, whole genome shotgun sequence",Marivita geojedonensis,233,233,90%,5.00E-67,46.33,106382,NZ_JFKC01000012.1
"Roseomonas aerophila strain NBRC 108923 Scaffold6, whole genome shotgun sequence",Roseomonas aerophila,233,233,89%,5.00E-67,47.47,159654,NZ_JACTVA010000006.1
"Rickettsia rickettsii str. Iowa, complete sequence",Rickettsia rickettsii str. Iowa,233,233,90%,5.00E-67,44.4,1268201,NC_010263.3
"Rickettsia conorii str. Malish 7, complete sequence",Rickettsia conorii str. Malish 7,233,233,90%,5.00E-67,44.4,1268755,NC_003103.1
"Rickettsia slovaca 13-B, complete sequence",Rickettsia slovaca 13-B,233,233,90%,5.00E-67,44.4,1275089,NC_016639.1
"Neomegalonema perideroedes DSM 15528 B161DRAFT_scaffold_0.1, whole genome shotgun sequence",Neomegalonema perideroedes DSM 15528,233,233,90%,5.00E-67,44.32,1522649,NZ_KB893653.1
"Devosia geojensis strain BD-c194 NODE_10, whole genome shotgun sequence",Devosia geojensis,233,233,91%,6.00E-67,44.87,27880,NZ_JZEX01000009.1
"Qipengyuania algicida strain KEMB 9005-328 NODE_2_length_449432, whole genome shotgun sequence",Qipengyuania algicida,233,233,90%,6.00E-67,46.9,449432,NZ_WTYA01000002.1
"Ancylobacter rudongensis strain CGMCC 1.1761, whole genome shotgun sequence",Ancylobacter rudongensis,233,233,90%,6.00E-67,44.74,664556,NZ_FMTP01000003.1
"Gluconobacter wancherniae NBRC 103581 sequence3, whole genome shotgun sequence",Gluconobacter wancherniae NBRC 103581,233,233,90%,6.00E-67,45.56,202301,NZ_BJUZ01000003.1
"Thalassococcus profundi strain WRAS1 scaffold_0, whole genome shotgun sequence",Thalassococcus profundi,233,233,89%,6.00E-67,47.08,494387,NZ_QPMK01000001.1
"Rickettsia asembonensis strain NMRCii contig00030, whole genome shotgun sequence",Rickettsia asembonensis,233,233,90%,6.00E-67,44.4,25405,NZ_JWSW01000020.1
"Nitrobacter hamburgensis X14, complete sequence",Nitrobacter hamburgensis X14,233,393,90%,6.00E-67,43.85,4406967,NC_007964.1
"Bradyrhizobium embrapense strain SEMIA 6208 scaffold16.1, whole genome shotgun sequence",Bradyrhizobium embrapense,233,233,90%,6.00E-67,43.85,87795,NZ_LFIP02000016.1
"Sandarakinorhabdus limnophila DSM 17366 G566DRAFT_scaffold00002.2_C, whole genome shotgun sequence",Sandarakinorhabdus limnophila DSM 17366,233,233,90%,6.00E-67,46.51,437350,NZ_ATVO01000004.1
"Albimonas donghaensis strain DSM 17890, whole genome shotgun sequence",Albimonas donghaensis,233,233,90%,6.00E-67,44.4,593400,NZ_FNMZ01000003.1
"Neorhizobium alkalisoli strain DSM 21826 NODE_17_length_81968_cov_56.7042, whole genome shotgun sequence",Neorhizobium alkalisoli,233,233,90%,6.00E-67,43.8,81968,NZ_PVBN01000017.1
"Gluconobacter kondonii strain NBRC 3266, whole genome shotgun sequence",Gluconobacter kondonii,233,233,90%,6.00E-67,46.33,287981,NZ_BEWP01000003.1
"Devosia submarina strain JCM 18935 scaffold4, whole genome shotgun sequence",Devosia submarina,233,233,91%,6.00E-67,44.11,331445,NZ_PYWB01000004.1
"Sulfitobacter pseudonitzschiae strain H46 chromosome, complete genome",Sulfitobacter pseudonitzschiae,233,233,90%,6.00E-67,47.67,3891549,NZ_CP054599.1
"Bradyrhizobium elkanii USDA 76 BraelDRAFT_scaffold1.1, whole genome shotgun sequence",Bradyrhizobium elkanii USDA 76,233,285,90%,6.00E-67,43.85,9116505,NZ_KB900701.1
"Gluconobacter albidus strain TMW2.1191 chromosome, complete genome",Gluconobacter albidus,233,233,90%,6.00E-67,46.33,3107922,NZ_CP014689.1
"Gemmobacter aquatilis strain DSM 3857, whole genome shotgun sequence",Gemmobacter aquatilis,232,306,89%,6.00E-67,49.02,770119,NZ_FOCE01000001.1
"Lutimaribacter litoralis strain DSM 29506, whole genome shotgun sequence",Lutimaribacter litoralis,232,232,90%,6.00E-67,47.49,474110,NZ_FXTO01000001.1
"Rickettsia sibirica 246 chromosome, whole genome shotgun sequence",Rickettsia sibirica 246,232,232,90%,6.00E-67,44.4,1250021,NZ_AABW01000001.1
"Rickettsia honei RB contig007, whole genome shotgun sequence",Rickettsia honei RB,232,232,90%,6.00E-67,44.4,62153,NZ_AJTT01000007.1
"Phaeobacter gallaeciensis strain P128 chromosome, complete genome",Phaeobacter gallaeciensis,232,232,90%,7.00E-67,46.33,3707098,NZ_CP021047.1
"Pseudaestuariivita atlantica strain 22II-S11-z3 contig4, whole genome shotgun sequence",Pseudaestuariivita atlantica,232,232,90%,7.00E-67,46.33,541814,NZ_AQQZ01000004.1
"Tabrizicola piscis strain K13M18 chromosome, complete genome",Tabrizicola piscis,232,232,90%,7.00E-67,47.67,4189112,NZ_CP034328.1
"Nitratireductor aquibiodomus strain ES.061, whole genome shotgun sequence",Nitratireductor aquibiodomus,232,232,89%,7.00E-67,44.75,4057001,NZ_FNSL01000001.1
"Neorhizobium vignae strain CCBAU 05176 contig19, whole genome shotgun sequence",Neorhizobium vignae,232,232,90%,7.00E-67,44.19,127877,NZ_JNNU01000017.1
"Methylobacterium platani strain PMB02 contig022, whole genome shotgun sequence",Methylobacterium platani,232,232,90%,7.00E-67,44.83,216734,NZ_LWHQ01000022.1
"Methylocapsa palsarum strain NE2, whole genome shotgun sequence",Methylocapsa palsarum,232,232,91%,7.00E-67,44.53,586010,NZ_FOSN01000001.1
"Salipiger pacificus strain CGMCC 1.3455, whole genome shotgun sequence",Salipiger pacificus,232,232,90%,7.00E-67,46.15,339443,NZ_FNCL01000007.1
"Methylorubrum rhodinum strain DSM 2163 Ga0373200_02, whole genome shotgun sequence",Methylorubrum rhodinum,232,232,90%,7.00E-67,44.79,456070,NZ_JACHOP010000002.1
"Jhaorihella thermophila strain DSM 23413, whole genome shotgun sequence",Jhaorihella thermophila,232,232,90%,7.00E-67,45.95,225149,NZ_FNVD01000006.1
"Luteovulum johrii strain JA192 Ga0191650_105, whole genome shotgun sequence",Luteovulum johrii,232,232,90%,7.00E-67,49.22,250397,NZ_PZZW01000005.1
"Blastomonas natatoria strain DSM 3183 Ga0215674_105, whole genome shotgun sequence",Blastomonas natatoria,232,232,89%,7.00E-67,47.86,266045,NZ_QJJM01000005.1
"Methylorubrum rhodesianum strain DSM 5687 Ga0373205_08, whole genome shotgun sequence",Methylorubrum rhodesianum,232,232,90%,7.00E-67,44.02,290901,NZ_JACHOS010000008.1
"Kiloniella majae strain M146.1 Contig3, whole genome shotgun sequence",Kiloniella majae,232,232,90%,7.00E-67,45.74,629451,NZ_MTSX01000003.1
"Bradyrhizobium oligotrophicum S58, complete sequence",Bradyrhizobium oligotrophicum S58,232,232,90%,8.00E-67,43.46,8264165,NC_020453.1
"Blastochloris tepida strain GI chromosome, complete genome",Blastochloris tepida,232,343,90%,8.00E-67,44.79,3949390,NZ_AP018907.1
"Rickettsia gravesii BWI-1 contig02, whole genome shotgun sequence",Rickettsia gravesii BWI-1,232,232,90%,8.00E-67,44.4,56746,NZ_AWXL01000002.1
"Bradyrhizobium brasilense strain UFLA0613 NODE_9_length_213672_cov_11.837912, whole genome shotgun sequence",Bradyrhizobium brasilense,232,232,90%,8.00E-67,43.85,213672,NZ_SNUC01000009.1
"Pelagibacterium montanilacus strain CCL18 349, whole genome shotgun sequence",Pelagibacterium montanilacus,232,232,91%,8.00E-67,44.49,140093,NZ_RZMX01000015.1
"Neorhizobium tomejilense strain T20_22 NODE_14_length_198052_cov_25.6367_ID_1390, whole genome shotgun sequence",Neorhizobium tomejilense,232,232,90%,8.00E-67,44.19,198052,NZ_PVBF01000014.1
"Sphingopyxis panaciterrae strain DSM 27164 Ga0373342_05, whole genome shotgun sequence",Sphingopyxis panaciterrae,232,232,89%,8.00E-67,46.3,366483,NZ_JAASQN010000005.1
"Bradyrhizobium pachyrhizi strain 1040 NODE_5_length_402668_cov_17.7088, whole genome shotgun sequence",Bradyrhizobium pachyrhizi,232,232,90%,8.00E-67,43.85,402668,NZ_WQNF01000005.1
"Luteovulum sphaeroides subsp. megalophilum strain DSM 18937, whole genome shotgun sequence",Luteovulum sphaeroides subsp. megalophilum,232,232,90%,8.00E-67,48.84,861493,NZ_FZOV01000002.1
"Rhodobacter sphaeroides ATCC 17029 chromosome 1, complete sequence",Rhodobacter sphaeroides ATCC 17029,232,323,90%,8.00E-67,48.84,3147721,NC_009049.1
"Altererythrobacter sediminis strain KCTC 42453 NODE_2_length_1077472, whole genome shotgun sequence",Altererythrobacter sediminis,232,232,89%,8.00E-67,46.3,1077472,NZ_WTYL01000002.1
"Methylobacterium nodulans ORS 2060, complete sequence",Methylobacterium nodulans ORS 2060,232,500,91%,9.00E-67,45.21,7772460,NC_011894.1
"Celeribacter persicus strain DSM 100434 Ga0183454_111, whole genome shotgun sequence",Celeribacter persicus,232,232,90%,9.00E-67,46.72,118769,NZ_QAOH01000011.1
"Sphingomonas oleivorans strain FW-11 scaffold6, whole genome shotgun sequence",Sphingomonas oleivorans,232,232,89%,9.00E-67,46.69,1065876,NZ_NWBU01000004.1
"Afipia felis strain NCTC12499, whole genome shotgun sequence",Afipia felis,232,285,90%,9.00E-67,43.85,4132564,NZ_UFSI01000001.1
"Methylorubrum extorquens PA1, complete sequence",Methylorubrum extorquens PA1,232,293,90%,9.00E-67,44.02,5471154,NC_010172.1
"Methylobacterium terrae strain 17Sr1-28 chromosome, complete genome",Methylobacterium terrae,232,438,91%,9.00E-67,44.44,6162702,NZ_CP029553.1
"Afipia clevelandensis ATCC 49720 supercont1.1, whole genome shotgun sequence",Afipia clevelandensis ATCC 49720,232,232,90%,9.00E-67,43.46,4399548,NZ_KB375281.1
"Nitratireductor pacificus pht-3B contig9, whole genome shotgun sequence",Nitratireductor pacificus pht-3B,232,232,89%,9.00E-67,45.91,172843,NZ_AMRM01000009.1
"Bradyrhizobium mercantei strain SEMIA 6399 scaffold5.1, whole genome shotgun sequence",Bradyrhizobium mercantei,232,232,90%,9.00E-67,43.46,883048,NZ_MKFI01000005.1
"Ruegeria sediminis strain CAU 1488 contig4, whole genome shotgun sequence",Ruegeria sediminis,232,232,90%,9.00E-67,47.1,563922,NZ_VCPD01000004.1
"Stappia taiwanensis strain CCM 7757 sequence11, whole genome shotgun sequence",Stappia taiwanensis,232,232,90%,9.00E-67,44.06,147368,NZ_BMCR01000011.1
"Limimaricola variabilis strain CECT 8572 Ga0372421_02, whole genome shotgun sequence",Limimaricola variabilis,232,232,90%,9.00E-67,45.56,532134,NZ_JACIBX010000002.1
"Pelagibacterium lentulum strain CGMCC 1.15896 sequence01, whole genome shotgun sequence",Pelagibacterium lentulum,232,232,91%,9.00E-67,44.11,1046324,NZ_BMKB01000001.1
"Methylobacterium frigidaeris strain IER25-16 C26075, whole genome shotgun sequence",Methylobacterium frigidaeris,232,232,90%,9.00E-67,44.19,10793,NZ_PELK01001625.1
"Vannielia litorea strain DSM 29440, whole genome shotgun sequence",Vannielia litorea,232,232,91%,9.00E-67,47.51,3644082,NZ_FSRL01000001.1
"Methylocystis heyeri strain H2 chromosome, complete genome",Methylocystis heyeri,232,283,91%,9.00E-67,42.8,4551947,NZ_CP046052.1
"Histidinibacterium lentulum strain B17 Scaffold3, whole genome shotgun sequence",Histidinibacterium lentulum,232,232,90%,1.00E-66,45.77,488705,NZ_ML119083.1
"Pannonibacter phragmitetus strain NCTC13350, whole genome shotgun sequence",Pannonibacter phragmitetus,232,232,90%,1.00E-66,44.83,4621478,NZ_UGSK01000001.1
"Aliiroseovarius pelagivivens strain CECT 8811, whole genome shotgun sequence",Aliiroseovarius pelagivivens,232,232,90%,1.00E-66,46.33,819404,NZ_OMOI01000002.1
"Roseomonas cervicalis ATCC 49957 SCAFFOLD4, whole genome shotgun sequence",Roseomonas cervicalis ATCC 49957,232,232,89%,1.00E-66,47.47,397691,NZ_GG770780.1
"Alkalilacustris brevis strain 34079 165, whole genome shotgun sequence",Alkalilacustris brevis,232,232,90%,1.00E-66,47.1,39675,NZ_QNVJ01000094.1
"Sedimentitalea nanhaiensis DSM 24252 Leina_neu_scaffold_2512211952.4, whole genome shotgun sequence",Sedimentitalea nanhaiensis DSM 24252,232,304,89%,1.00E-66,45.14,4411177,NZ_KI421509.1
"Natronohydrobacter thiooxidans strain AH01 AH01_contig_1, whole genome shotgun sequence",Natronohydrobacter thiooxidans,232,232,89%,1.00E-66,47.47,254341,NZ_MJAP01000001.1
"Phaeobacter piscinae strain S26 Phaeobacter_S26_contig_17, whole genome shotgun sequence",Phaeobacter piscinae,232,232,90%,1.00E-66,46.72,262523,NZ_JSWK01000017.1
"Sphingomonas daechungensis strain KACC 18115 chromosome, complete genome",Sphingomonas daechungensis,232,232,89%,1.00E-66,45.53,2880004,NZ_CP060780.1
"Croceicoccus pelagius strain Ery9 Ery9_C37_384818, whole genome shotgun sequence",Croceicoccus pelagius,231,231,89%,1.00E-66,45.53,384818,NZ_LYWY01000037.1
"Devosia subaequoris strain DSM 23447 Ga0373328_04, whole genome shotgun sequence",Devosia subaequoris,231,231,91%,1.00E-66,43.73,385987,NZ_JACIEW010000004.1
"Devosia marina strain L53-10-65 NODE_2_length_636985_cov_56.763128, whole genome shotgun sequence",Devosia marina,231,231,91%,1.00E-66,43.73,636889,NZ_WQRF01000002.1
"Rhodovarius lipocyclicus strain CCUG 44693 contig00013, whole genome shotgun sequence",Rhodovarius lipocyclicus,231,231,90%,1.00E-66,46.72,81835,NZ_JAAABL010000013.1
"Aestuariivirga litoralis strain KCTC 52945 M10001_Contig3, whole genome shotgun sequence",Aestuariivirga litoralis,231,231,91%,1.00E-66,43.51,505639,NZ_QKVK01000003.1
"Rickettsia felis str. Pedreira rfPED.contig.0_1, whole genome shotgun sequence",Rickettsia felis str. Pedreira,231,231,90%,1.00E-66,44.02,1485193,NZ_LANQ01000001.1
"Devosia indica strain IO390501 scaffold11, whole genome shotgun sequence",Devosia indica,231,231,91%,1.00E-66,43.73,147661,NZ_PYVZ01000011.1
Rickettsia raoultii strain IM16 chromosome,Rickettsia raoultii,231,231,90%,1.00E-66,44.02,1344557,NZ_CP019435.1
"Bradyrhizobium ivorense strain CI-1B isolate CI-1B, whole genome shotgun sequence",Bradyrhizobium ivorense,231,231,90%,1.00E-66,43.85,1742598,NZ_CAADFC020000004.1
"Jannaschia pohangensis strain DSM 19073, whole genome shotgun sequence",Jannaschia pohangensis,231,231,91%,1.00E-66,46.18,240209,NZ_FORA01000005.1
"Thalassorhabdomicrobium marinisediminis strain BH-SD16 BH16_scaffold2, whole genome shotgun sequence",Thalassorhabdomicrobium marinisediminis,231,231,90%,1.00E-66,47.1,443970,NZ_QCYG01000002.1
"Tsuneonella flava strain MS1-4 contig5, whole genome shotgun sequence",Tsuneonella flava,231,231,90%,1.00E-66,45.35,634876,NZ_PHSO01000005.1
"Celeribacter halophilus strain DSM 26270 LX82DRAFT_scaffold00009.9, whole genome shotgun sequence",Celeribacter halophilus,231,231,90%,1.00E-66,46.33,157608,NZ_QKZJ01000009.1
"Pseudorhodoplanes sinuspersici strain RIPI110 chromosome, complete genome",Pseudorhodoplanes sinuspersici,231,285,90%,1.00E-66,44.23,5971615,NZ_CP021112.1
"Pannonibacter carbonis strain Q4.6 Scaffold12, whole genome shotgun sequence",Pannonibacter carbonis,231,231,90%,1.00E-66,44.44,162144,NZ_PUDR01000012.1
"Rickettsia amblyommatis str. Darkwater craDarkwater.contig.25_1, whole genome shotgun sequence",Rickettsia amblyommatis str. Darkwater,231,231,90%,1.00E-66,44.4,82301,NZ_LAOH01000026.1
"Aliiroseovarius halocynthiae strain MA1-10 Scaffold5, whole genome shotgun sequence",Aliiroseovarius halocynthiae,231,231,90%,1.00E-66,47.49,166853,NZ_ML660023.1
"Albidovulum xiamenense strain CGMCC 1.10789, whole genome shotgun sequence",Albidovulum xiamenense,231,231,90%,2.00E-66,46.72,777930,NZ_FNFV01000001.1
"Komagataeibacter melaceti strain AV382 NODE_167_length_61831_cov_62.451763, whole genome shotgun sequence",Komagataeibacter melaceti,231,231,90%,2.00E-66,45.95,61919,NZ_QUWV01000151.1
"Methylobacterium aquaticum strain DSM 16371 contig_2, whole genome shotgun sequence",Methylobacterium aquaticum,231,231,90%,2.00E-66,44.83,60702,NZ_LABX01000002.1
"Xanthobacter autotrophicus strain DSM 432 NODE_5, whole genome shotgun sequence",Xanthobacter autotrophicus,231,231,90%,2.00E-66,44.79,381522,NZ_VAUP01000035.1
"Croceicoccus ponticola strain GM-16 2, whole genome shotgun sequence",Croceicoccus ponticola,231,231,89%,2.00E-66,45.91,411713,NZ_RXOL01000002.1
"Nesiotobacter exalbescens strain WB1-6 contig_21, whole genome shotgun sequence",Nesiotobacter exalbescens,231,231,90%,2.00E-66,43.89,631263,NZ_LVVZ01000014.1
"Rickettsia buchneri strain ISO7 contig095, whole genome shotgun sequence",Rickettsia buchneri,231,231,90%,2.00E-66,43.63,11178,NZ_JFKF01000095.1
"Roseomonas alkaliterrae strain DSM 25895 Ga0373337_01, whole genome shotgun sequence",Roseomonas alkaliterrae,231,231,90%,2.00E-66,46.33,692816,NZ_JACIJE010000001.1
"Phaeobacter inhibens strain P54 chromosome, complete genome",Phaeobacter inhibens,231,231,90%,2.00E-66,46.33,3706428,NZ_CP010650.1
"Rhodoplanes piscinae isolate Rhod_genome, whole genome shotgun sequence",Rhodoplanes piscinae,231,231,90%,2.00E-66,44.02,6987,NZ_UWOC01000047.1
"Blastochloris sulfoviridis strain DSM 729 NODE_40_length_28377_cov_40.7152, whole genome shotgun sequence",Blastochloris sulfoviridis,231,231,90%,2.00E-66,44.57,28377,NZ_VWPL01000040.1
"Tardiphaga robiniae strain LMG 26467 k141_106, whole genome shotgun sequence",Tardiphaga robiniae,231,231,90%,2.00E-66,43.46,798763,NZ_JABMCJ010000094.1
"Pelagibacterium halotolerans strain ANSP101 chromosome, complete genome",Pelagibacterium halotolerans,231,231,91%,2.00E-66,43.82,3962298,NZ_CP053086.1
"Kiloniella litopenaei strain P1-1 contig5, whole genome shotgun sequence",Kiloniella litopenaei,231,231,90%,2.00E-66,45.74,332335,NZ_LANI01000005.1
"Pelagivirga sediminicola strain BH-SD19 BH19_scaffold3, whole genome shotgun sequence",Pelagivirga sediminicola,231,231,90%,2.00E-66,46.12,403533,NZ_QCYH01000003.1
