Description,Scientific Name,Max Score,Total Score,Query Cover,E value,Per. ident,Acc. Len,Accession  
"Sphingobium cloacae strain JCM 10874 plasmid pSCLO_7, complete sequence",Sphingobium cloacae,92,92,89%,2.00E-18,28.19,33768,NZ_AP017661.1
"Nioella nitratireducens strain SSW136 contig4, whole genome shotgun sequence",Nioella nitratireducens,92,92,90%,2.00E-18,28.14,263909,NZ_MNBW01000004.1
"Neokomagataea tanensis strain AH13 = NBRC 106556 plasmid unnamed1, complete sequence",Neokomagataea tanensis,92,92,67%,3.00E-18,30.65,99723,NZ_CP032486.1
"Epibacterium scottomollicae strain DSM 25328 Ga0181014_101, whole genome shotgun sequence",Epibacterium scottomollicae,92,92,89%,3.00E-18,27.63,820415,NZ_PVUF01000001.1
"Acetobacter ghanensis strain LMG 23848 contig00022, whole genome shotgun sequence",Acetobacter ghanensis,91.3,91.3,67%,5.00E-18,33.98,5296,NZ_WOTE01000022.1
"Salipiger pacificus strain CGMCC 1.3455, whole genome shotgun sequence",Salipiger pacificus,91.3,91.3,90%,5.00E-18,28.46,379891,NZ_FNCL01000006.1
"Acuticoccus sediminis strain PTG4-2 contig12, whole genome shotgun sequence",Acuticoccus sediminis,90.9,90.9,80%,6.00E-18,30.49,109544,NZ_QHHQ01000012.1
"Roseicyclus mahoneyensis strain DSM 16097 Ga0215646_104, whole genome shotgun sequence",Roseicyclus mahoneyensis,90.9,90.9,87%,6.00E-18,29.13,392070,NZ_QGGW01000004.1
"Gluconobacter morbifer G707 75_17, whole genome shotgun sequence",Gluconobacter morbifer G707,90.9,90.9,67%,7.00E-18,31.16,24947,NZ_AGQV01000017.1
"Aureimonas frigidaquae strain JCM 14755, whole genome shotgun sequence",Aureimonas frigidaquae,90.1,90.1,90%,1.00E-17,27.31,160206,NZ_BBWR01000009.1
"Phaeobacter marinintestinus strain UB-M7 UB-M7_scaffold3, whole genome shotgun sequence",Phaeobacter marinintestinus,90.1,90.1,90%,1.00E-17,24.9,550752,NZ_VOGO01000003.1
"Mesorhizobium camelthorni strain CCNWXJ 40-4 52, whole genome shotgun sequence",Mesorhizobium camelthorni,89.7,89.7,80%,2.00E-17,25,35552,NZ_JAAKZF010000052.1
"Roseivivax halotolerans strain JCM 10271, whole genome shotgun sequence",Roseivivax halotolerans,89.7,89.7,91%,2.00E-17,26.34,78282,NZ_FOXV01000016.1
"Gluconacetobacter sacchari strain LMG 19747 contig00050, whole genome shotgun sequence",Gluconacetobacter sacchari,88.6,88.6,73%,3.00E-17,29.68,14425,NZ_JABEQJ010000050.1
"Donghicola tyrosinivorans strain DSM 100212 Ga0181042_106, whole genome shotgun sequence",Donghicola tyrosinivorans,88.6,157,90%,4.00E-17,27.44,230516,NZ_PVTQ01000006.1
"Cohaesibacter marisflavi strain CGMCC 1.9157, whole genome shotgun sequence",Cohaesibacter marisflavi,88.6,88.6,90%,4.00E-17,26.44,108687,NZ_FOVR01000016.1
"Mesorhizobium atlanticum strain CNPSo 3140 scaffold_0, whole genome shotgun sequence",Mesorhizobium atlanticum,88.6,88.6,60%,4.00E-17,32.97,1004222,NZ_QMBQ01000001.1
"Sinirhodobacter populi strain 2D-5 17, whole genome shotgun sequence",Sinirhodobacter populi,88.2,88.2,90%,5.00E-17,28.19,95232,NZ_SAUW01000017.1
"Bradyrhizobium liaoningense strain CCNWSX0360 Scaffold8_1, whole genome shotgun sequence",Bradyrhizobium liaoningense,87.4,87.4,89%,9.00E-17,28.87,270168,NZ_LUKO01000231.1
"Roseivivax isoporae LMG 25204 contig5, whole genome shotgun sequence",Roseivivax isoporae LMG 25204,87.4,87.4,90%,1.00E-16,27.03,192501,NZ_JAME01000005.1
"Ruegeria profundi strain ZGT108 ZB100000, whole genome shotgun sequence",Ruegeria profundi,87.4,87.4,90%,1.00E-16,25.66,726258,NZ_LQBP01000001.1
"Pseudodonghicola xiamenensis DSM 18339 G455DRAFT_scaffold00001.1_C, whole genome shotgun sequence",Pseudodonghicola xiamenensis DSM 18339,87,87,91%,1.00E-16,27.55,611487,NZ_AUBS01000001.1
"Salipiger marinus strain DSM 26424, whole genome shotgun sequence",Salipiger marinus,86.3,86.3,90%,2.00E-16,26.05,378633,NZ_FNEJ01000001.1
"Salipiger thiooxidans strain DSM 10146, whole genome shotgun sequence",Salipiger thiooxidans,86.3,86.3,90%,2.00E-16,26.64,462456,NZ_FNAV01000001.1
"Magnetospirillum molischianum DSM 120, whole genome shotgun sequence",Magnetospirillum molischianum DSM 120,85.9,85.9,87%,3.00E-16,29.2,94864,NZ_CAHP01000035.1
"Cohaesibacter haloalkalitolerans strain JC131 NODE_13_length_70649_cov_38.8353, whole genome shotgun sequence",Cohaesibacter haloalkalitolerans,85.5,85.5,90%,4.00E-16,26.64,70649,NZ_QNUM01000013.1
"Aureimonas endophytica strain CGMCC 1.15367 sequence05, whole genome shotgun sequence",Aureimonas endophytica,85.5,85.5,90%,5.00E-16,29.21,413526,NZ_BMIQ01000005.1
"Paracoccus gahaiensis strain KCTC 42687 Scaffold10_1, whole genome shotgun sequence",Paracoccus gahaiensis,84.7,84.7,90%,8.00E-16,24.23,136386,NZ_SUNI01000011.1
"Acuticoccus kandeliae strain J103 NODE_7_length_37471_cov_57.0153, whole genome shotgun sequence",Acuticoccus kandeliae,84.7,84.7,80%,8.00E-16,28.98,37471,NZ_QBBV01000007.1
"Rhizobium oryzae strain 1.7048 C514, whole genome shotgun sequence",Rhizobium oryzae,84.3,150,88%,1.00E-15,26.69,188982,NZ_MKIP01000030.1
"Agrobacterium vitis strain NCPPB 3554 contig11, whole genome shotgun sequence",Agrobacterium vitis,83.6,83.6,90%,2.00E-15,22.39,103440,NZ_LMVL02000011.1
"Gemmobacter lanyuensis strain KCTC 23714 sequence01, whole genome shotgun sequence",Gemmobacter lanyuensis,83.2,83.2,87%,2.00E-15,30.43,1039284,NZ_BMYQ01000001.1
"Paracoccus litorisediminis strain NBRC 112902 Scaffold29, whole genome shotgun sequence",Paracoccus litorisediminis,83.2,83.2,90%,3.00E-15,24.9,40952,NZ_WMIG01000029.1
"Yoonia vestfoldensis DSM 16212 H147DRAFT_scaffold00016.16, whole genome shotgun sequence",Yoonia vestfoldensis DSM 16212,83.2,83.2,90%,3.00E-15,27.2,85987,NZ_KB907988.1
"Donghicola mangrovi strain B5-SW-15 13, whole genome shotgun sequence",Donghicola mangrovi,82.8,82.8,90%,4.00E-15,26.44,98425,NZ_JABCJE010000013.1
"Pararhodospirillum oryzae strain NBRC 107573 sequence143, whole genome shotgun sequence",Pararhodospirillum oryzae,82.4,82.4,88%,5.00E-15,28.85,4789,NZ_BJZO01000143.1
"Methylobacterium aquaticum strain DSM 16371 contig_227, whole genome shotgun sequence",Methylobacterium aquaticum,82,82,91%,5.00E-15,29.1,11175,NZ_LABX01000227.1
"Marinibacterium profundimaris strain 22II1-22F33 contig3, whole genome shotgun sequence",Marinibacterium profundimaris,82,82,90%,7.00E-15,25.56,656488,NZ_AQQR01000003.1
"Albibacillus kandeliae strain J95 Scaffold12, whole genome shotgun sequence",Albibacillus kandeliae,81.6,81.6,90%,8.00E-15,27,156438,NZ_QEHM01000012.1
"Luteovulum azotoformans strain KA25 Ga0191649_102, whole genome shotgun sequence",Luteovulum azotoformans,80.9,80.9,87%,2.00E-14,29.37,336145,NZ_QAOT01000002.1
"Pelagibacterium lentulum strain CGMCC 1.15896 sequence12, whole genome shotgun sequence",Pelagibacterium lentulum,80.9,80.9,80%,2.00E-14,28.46,37032,NZ_BMKB01000012.1
"Ruegeria profundi strain ZGT108 ZB100002, whole genome shotgun sequence",Ruegeria profundi,80.5,80.5,89%,2.00E-14,25.97,511024,NZ_LQBP01000003.1
"Donghicola mangrovi strain B5-SW-15 6, whole genome shotgun sequence",Donghicola mangrovi,80.1,80.1,80%,3.00E-14,28.98,181473,NZ_JABCJE010000006.1
"Paracoccus indicus strain IO390502 scaffold6, whole genome shotgun sequence",Paracoccus indicus,80.1,150,90%,3.00E-14,24.23,341787,NZ_PYWA01000006.1
"Gemmobacter lanyuensis strain KCTC 23714 sequence14, whole genome shotgun sequence",Gemmobacter lanyuensis,79.7,79.7,80%,3.00E-14,29.03,100279,NZ_BMYQ01000014.1
"Luteovulum sphaeroides subsp. megalophilum strain DSM 18937, whole genome shotgun sequence",Luteovulum sphaeroides subsp. megalophilum,79.7,79.7,87%,3.00E-14,29.2,1118752,NZ_FZOV01000001.1
"Cereibacter changlensis strain DSM 18774 LX76DRAFT_scaffold00021.21, whole genome shotgun sequence",Cereibacter changlensis,79.7,79.7,80%,3.00E-14,28.46,46584,NZ_QKZS01000021.1
"Hwanghaeicola aestuarii strain DSM 22009 LX81DRAFT_scaffold00005.5, whole genome shotgun sequence",Hwanghaeicola aestuarii,79.7,79.7,90%,4.00E-14,25,330290,NZ_QKZL01000005.1
"Pseudooceanicola flagellatus strain CGMCC 1.12664 sequence04, whole genome shotgun sequence",Pseudooceanicola flagellatus,79.7,147,80%,4.00E-14,28.98,213325,NZ_BMFJ01000004.1
"Nitratireductor indicus strain CGMCC 1.10953, whole genome shotgun sequence",Nitratireductor indicus,79.7,79.7,80%,4.00E-14,27.46,98146,NZ_FOXZ01000015.1
"Mesorhizobium sediminum strain KCTC 42205 5, whole genome shotgun sequence",Mesorhizobium sediminum,79.7,79.7,80%,4.00E-14,27.46,264702,NZ_JABETK010000005.1
"Ochrobactrum daejeonense strain DSM 26944 Ga0373340_37, whole genome shotgun sequence",Ochrobactrum daejeonense,79.3,79.3,80%,4.00E-14,27.94,11823,NZ_JACIJG010000037.1
"Ochrobactrum pecoris strain 08RB2639 contig23, whole genome shotgun sequence",Ochrobactrum pecoris,79.3,79.3,80%,4.00E-14,27.94,27035,NZ_VEWK01000023.1
"Ochrobactrum rhizosphaerae strain PR17 OrhDSM_1.contig.18_1, whole genome shotgun sequence",Ochrobactrum rhizosphaerae,79.3,79.3,80%,4.00E-14,27.94,44387,NZ_NNRK01000019.1
"Ochrobactrum lupini strain LUP21 OluLMG_1.contig.55_1, whole genome shotgun sequence",Ochrobactrum lupini,79.3,79.3,80%,5.00E-14,27.94,171620,NZ_NNRN01000056.1
Methylobacterium brachiatum strain TX0642 plasmid unnamed1,Methylobacterium brachiatum,79.3,79.3,75%,5.00E-14,30.04,286730,NZ_CP033232.1
"Sulfitobacter brevis strain DSM 11443, whole genome shotgun sequence",Sulfitobacter brevis,79,79,75%,6.00E-14,30.47,9710,NZ_FOMW01000037.1
"Yoonia vestfoldensis DSM 16212 H147DRAFT_scaffold00031.31, whole genome shotgun sequence",Yoonia vestfoldensis DSM 16212,79,79,75%,6.00E-14,30.47,18061,NZ_KB908003.1
"Roseibaca ekhonensis strain CECT 7235, whole genome shotgun sequence",Roseibaca ekhonensis,79,79,75%,6.00E-14,30.47,46956,NZ_UIHC01000024.1
"Ponticoccus marisrubri strain SJ5A-1 ZB100020, whole genome shotgun sequence",Ponticoccus marisrubri,79,79,91%,7.00E-14,25.19,47981,NZ_LPXO01000021.1
"Martelella limonii strain NBRC 109441 NODE_5, whole genome shotgun sequence",Martelella limonii,79,79,80%,7.00E-14,26.91,276106,NZ_JABUOU010000005.1
"Pseudogemmobacter bohemicus strain Cd-10 scaffold00006, whole genome shotgun sequence",Pseudogemmobacter bohemicus,79,79,80%,8.00E-14,27.64,218700,NZ_QNHG01000006.1
"Ochrobactrum gallinifaecis strain ISO 196 scaffold10, whole genome shotgun sequence",Ochrobactrum gallinifaecis,78.6,78.6,80%,8.00E-14,26.8,124145,NZ_ML636809.1
"Tritonibacter horizontis strain O3.65 TRIHO_contig000037, whole genome shotgun sequence",Tritonibacter horizontis,78.6,78.6,88%,8.00E-14,26.95,11185,NZ_LPUY01000037.1
"Mesorhizobium carmichaelinearum strain ICMP 18942, whole genome shotgun sequence",Mesorhizobium carmichaelinearum,78.6,78.6,80%,8.00E-14,27.53,114246,NZ_FZQR01000017.1
"Devosia geojensis strain BD-c194 NODE_179, whole genome shotgun sequence",Devosia geojensis,78.6,78.6,80%,9.00E-14,26.64,97426,NZ_JZEX01000173.1
"Methylorubrum zatmanii strain LMG 6087 Methylo-6087_S2_L001_R1_001__paired__contig_74, whole genome shotgun sequence",Methylorubrum zatmanii,78.6,78.6,91%,9.00E-14,28.14,13875,NZ_NKUI01000074.1
"Paracoccus haeundaensis strain CGMCC 1.8012 Scaffold30_1, whole genome shotgun sequence",Paracoccus haeundaensis,78.6,78.6,90%,9.00E-14,23.08,37208,NZ_VDDC01000038.1
"Martelella mediterranea DSM 17316 strain MACL11 plasmid pMM170, complete sequence",Martelella mediterranea DSM 17316,78.6,78.6,80%,1.00E-13,26.72,169914,NZ_CP020333.1
"Methylobacterium gossipiicola strain Gh-105, whole genome shotgun sequence",Methylobacterium gossipiicola,78.6,78.6,80%,1.00E-13,27.24,131672,NZ_FOPM01000011.1
"Thalassospira mesophila strain JCM 18969 contig11, whole genome shotgun sequence",Thalassospira mesophila,78.6,78.6,86%,1.00E-13,26.52,139759,NZ_JFKA01000011.1
"Agrobacterium rhizogenes strain CF263 EW85DRAFT_scaffold00007.7_C, whole genome shotgun sequence",Agrobacterium rhizogenes,78.6,78.6,80%,1.00E-13,28.11,226616,NZ_JUHF01000014.1
"Agrobacterium fabrum strain PDC82, whole genome shotgun sequence",Agrobacterium fabrum,78.6,78.6,80%,1.00E-13,28.11,235343,NZ_FNEW01000007.1
"Rhizobium wenxiniae strain DSM 100734 Ga0415301_04, whole genome shotgun sequence",Rhizobium wenxiniae,78.2,78.2,68%,1.00E-13,31.58,449926,NZ_JACHEG010000004.1
"Roseomonas oryzae strain KCTC 42542 Scaffold7, whole genome shotgun sequence",Roseomonas oryzae,78.2,78.2,80%,1.00E-13,28.69,211192,NZ_VUKA01000007.1
"Chachezhania antarctica strain SM1703 scaffold16, whole genome shotgun sequence",Chachezhania antarctica,78.2,78.2,90%,1.00E-13,25.38,78410,NZ_QZEX01000016.1
"Aquicoccus porphyridii strain L1 8-17 scaffold_20, whole genome shotgun sequence",Aquicoccus porphyridii,78.2,78.2,80%,1.00E-13,28.46,60775,NZ_VINQ01000021.1
"Pelagibacterium luteolum strain CGMCC 1.10267, whole genome shotgun sequence",Pelagibacterium luteolum,78.2,78.2,80%,1.00E-13,26.64,47731,NZ_FNCS01000023.1
"Falsochrobactrum shanghaiense strain HN4 HM4_scaffold4, whole genome shotgun sequence",Falsochrobactrum shanghaiense,78.2,144,68%,1.00E-13,29.94,392389,NZ_QGDB01000004.1
"Rhizobium lusitanum strain YR374 EX07DRAFT_scaffold00010.10_C, whole genome shotgun sequence",Rhizobium lusitanum,77.8,77.8,80%,2.00E-13,28.11,263403,NZ_JUHT01000012.1
"Gemmobacter intermedius strain 119/4 Scaffold44, whole genome shotgun sequence",Gemmobacter intermedius,77.8,77.8,80%,2.00E-13,28.05,18110,NZ_SBLC01000044.1
"Fluviibacterium aquatile strain SM1902 SM1902_scaffold100, whole genome shotgun sequence",Fluviibacterium aquatile,77.8,77.8,80%,2.00E-13,28.46,7212,NZ_SMZO01000100.1
"Rhodovulum strictum strain DSM 11289 NODE_19_length_75814_cov_48.3957, whole genome shotgun sequence",Rhodovulum strictum,77.8,150,80%,2.00E-13,28.05,75814,NZ_WJPO01000019.1
"Roseivivax halodurans JCM 10272 contig88, whole genome shotgun sequence",Roseivivax halodurans JCM 10272,77.4,77.4,55%,2.00E-13,32.3,2928,NZ_JALZ01000088.1
"Thalassospira marina strain CSC3H3 plasmid pCSC3H3, complete sequence",Thalassospira marina,77.8,77.8,86%,2.00E-13,25.38,908044,NZ_CP024200.1
"Paracoccus ravus strain YJ057 YJ057_24, whole genome shotgun sequence",Paracoccus ravus,77.8,77.8,87%,2.00E-13,25.49,57953,NZ_SDEB01000024.1
"Defluviimonas denitrificans strain DSM 18921 LX70DRAFT_scaffold00009.9, whole genome shotgun sequence",Defluviimonas denitrificans,77.8,77.8,80%,2.00E-13,28.86,153220,NZ_PVEP01000009.1
"Nitratireductor arenosus strain CAU 1489 contig9, whole genome shotgun sequence",Nitratireductor arenosus,77.4,77.4,80%,2.00E-13,27.24,99688,NZ_WPHG01000009.1
"Paracoccus aestuariivivens strain NBRC 111993 Scaffold4, whole genome shotgun sequence",Paracoccus aestuariivivens,77.4,77.4,87%,2.00E-13,24.3,289137,NZ_WMIE01000004.1
"Rhizobium cellulosilyticum strain SEMIA 448 Ga0394319_04, whole genome shotgun sequence",Rhizobium cellulosilyticum,77.4,147,80%,2.00E-13,31.1,477454,NZ_JACIGW010000004.1
"Martelella mediterranea DSM 17316 strain MACL11 plasmid pMM259, complete sequence",Martelella mediterranea DSM 17316,77.4,135,80%,2.00E-13,28.46,258597,NZ_CP020332.1
"Cognatishimia maritima strain DSM 28223, whole genome shotgun sequence",Cognatishimia maritima,77.4,145,80%,2.00E-13,27.24,268291,NZ_FQWM01000003.1
"Ruegeria denitrificans strain CECT 5091, whole genome shotgun sequence",Ruegeria denitrificans,77.4,77.4,90%,2.00E-13,24.9,393993,NZ_CYUD01000003.1
"Hansschlegelia zhihuaiae strain S 113 Scaffold8, whole genome shotgun sequence",Hansschlegelia zhihuaiae,77,77,86%,3.00E-13,27.61,192982,NZ_RYFI01000008.1
"Luteovulum sphaeroides subsp. megalophilum strain DSM 18937, whole genome shotgun sequence",Luteovulum sphaeroides subsp. megalophilum,77,77,80%,3.00E-13,28.46,35587,NZ_FZOV01000016.1
"Hirschia maritima DSM 19733 F551DRAFT_scaffold00001.1, whole genome shotgun sequence",Hirschia maritima DSM 19733,77,77,80%,3.00E-13,28.74,1141328,NZ_KB899544.1
"Sagittula stellata E-37 1101159001450, whole genome shotgun sequence",Sagittula stellata E-37,77,77,80%,3.00E-13,28.16,238607,NZ_AAYA01000007.1
"Roseivivax halodurans JCM 10272 contig73, whole genome shotgun sequence",Roseivivax halodurans JCM 10272,77,77,54%,3.00E-13,32.91,7336,NZ_JALZ01000073.1
"Rhizobium album strain NS-104 Scaffold11, whole genome shotgun sequence",Rhizobium album,77,77,80%,3.00E-13,27.57,214976,NZ_QFBC01000011.1
"Thalassococcus profundi strain WRAS1 scaffold_17, whole genome shotgun sequence",Thalassococcus profundi,77,77,80%,3.00E-13,28.86,98362,NZ_QPMK01000018.1
"Methylobacterium symbioticum strain SB0023/3, whole genome shotgun sequence",Methylobacterium symbioticum,76.6,76.6,88%,3.00E-13,27.78,28598,NZ_CABFPH010000068.1
"Tropicibacter naphthalenivorans strain DSM 19561, whole genome shotgun sequence",Tropicibacter naphthalenivorans,76.6,76.6,80%,4.00E-13,28.16,175743,NZ_FWXX01000008.1
"Paracoccus alkanivorans strain 4-2 Scaffold9, whole genome shotgun sequence",Paracoccus alkanivorans,76.6,76.6,54%,4.00E-13,34.62,153635,NZ_QOKZ01000009.1
"Paracoccus pantotrophus strain DSM 2944 Ga0242593_14, whole genome shotgun sequence",Paracoccus pantotrophus,76.6,76.6,80%,4.00E-13,28.05,99951,NZ_RBLI01000004.1
"Sphingobium baderi LL03 25433_scaffold_04, whole genome shotgun sequence",Sphingobium baderi LL03,76.6,76.6,68%,4.00E-13,29.27,58074,NZ_KQ130474.1
"Mesorhizobium waimense strain ICMP19557 NODE_83_length_13161_cov_12.9452, whole genome shotgun sequence",Mesorhizobium waimense,76.6,76.6,80%,4.00E-13,27.27,13080,NZ_QZWZ01000083.1
"Kandeliimicrobium roseum strain XY-R6 contig15, whole genome shotgun sequence",Kandeliimicrobium roseum,76.6,76.6,80%,4.00E-13,28.16,90625,NZ_PNOS01000015.1
"Ruegeria marina strain CGMCC 1.9108, whole genome shotgun sequence",Ruegeria marina,76.6,76.6,77%,4.00E-13,26.58,487351,NZ_FMZV01000001.1
"Methylobacterium haplocladii strain NBRC 107714 sequence032, whole genome shotgun sequence",Methylobacterium haplocladii,76.6,76.6,75%,4.00E-13,26.29,105247,NZ_BJZT01000032.1
"Paenirhodobacter enshiensis strain DW2-9 contig47_scaffold23, whole genome shotgun sequence",Paenirhodobacter enshiensis,76.6,76.6,80%,4.00E-13,28.16,24469,NZ_JFZB01000046.1
"Roseovarius nitratireducens strain TFZ 447, whole genome shotgun sequence",Roseovarius nitratireducens,76.3,76.3,80%,5.00E-13,28.46,20340,NZ_PDNI01000034.1
"Litoreibacter halocynthiae strain DSM 29467 Ga0104493_15, whole genome shotgun sequence",Litoreibacter halocynthiae,76.3,76.3,80%,5.00E-13,28.57,111608,NZ_SOBH01000005.1
"Natronohydrobacter thiooxidans strain AH01 AH01_contig_21, whole genome shotgun sequence",Natronohydrobacter thiooxidans,76.3,76.3,80%,5.00E-13,28.05,6104,NZ_MJAP01000021.1
"Paracoccus aestuarii strain DSM 19484 NODE_80_length_15385_cov_38.496, whole genome shotgun sequence",Paracoccus aestuarii,76.3,76.3,90%,6.00E-13,24.23,15385,NZ_QZEV01000080.1
"Microvirga tunisiensis strain Lmie10 NODE_86_length_23189_cov_92.4222_ID_12667, whole genome shotgun sequence",Microvirga tunisiensis,76.3,76.3,80%,6.00E-13,27.05,23189,NZ_VOSK01000086.1
"Ochrobactrum rhizosphaerae strain PR17 OrhDSM_1.contig.20_1, whole genome shotgun sequence",Ochrobactrum rhizosphaerae,76.3,76.3,80%,6.00E-13,25.2,88472,NZ_NNRK01000021.1
"Caenispirillum bisanense strain USBA 140, whole genome shotgun sequence",Caenispirillum bisanense,76.3,76.3,76%,6.00E-13,27.62,122049,NZ_OCNJ01000012.1
"Aminobacter lissarensis strain DSM 17454 Ga0415344_14, whole genome shotgun sequence",Aminobacter lissarensis,76.3,76.3,80%,6.00E-13,27.27,152615,NZ_JACHGI010000014.1
"Leisingera aquaemixtae strain R2C4 plasmid unnamed4, complete sequence",Leisingera aquaemixtae,76.3,76.3,80%,6.00E-13,27.76,59812,NZ_CP041158.1
"Rubellimicrobium roseum strain YIM 48858 Scaffold101_1, whole genome shotgun sequence",Rubellimicrobium roseum,75.9,75.9,80%,6.00E-13,26.21,4165,NZ_VDFV01000104.1
"Phyllobacterium myrsinacearum strain HAMBI_1992 EJMNOJEN_6, whole genome shotgun sequence",Phyllobacterium myrsinacearum,75.9,75.9,80%,7.00E-13,25.5,326529,NZ_QLKY01000006.1
"Rhizobium smilacinae strain PTYR-5 ZB100001, whole genome shotgun sequence",Rhizobium smilacinae,75.9,144,80%,7.00E-13,30.14,864686,NZ_VDMN01000002.1
"Leisingera caerulea DSM 24564 PhacaeDRAFT_Contig176.4_C, whole genome shotgun sequence",Leisingera caerulea DSM 24564,75.9,75.9,80%,7.00E-13,27.76,70306,NZ_AXBI01000011.1
"Gemmobacter nanjingensis strain KCTC 23298 sequence29, whole genome shotgun sequence",Gemmobacter nanjingensis,75.9,75.9,80%,7.00E-13,28.05,28256,NZ_BMYI01000029.1
"Mesorhizobium qingshengii strain CGMCC 1.12097, whole genome shotgun sequence",Mesorhizobium qingshengii,75.9,75.9,80%,8.00E-13,27.13,48844,NZ_FMXM01000031.1
"Chelativorans multitrophicus strain DSM 9103 scaffold10.1-size59357, whole genome shotgun sequence",Chelativorans multitrophicus,75.9,75.9,80%,8.00E-13,25.93,59357,NZ_JAAAPL010000010.1
"Chelativorans oligotrophicus strain LPM-4 scaffold6.1-size324329, whole genome shotgun sequence",Chelativorans oligotrophicus,75.9,75.9,80%,8.00E-13,25.93,324329,NZ_WUJL01000006.1
"Epibacterium mobile F1926 plasmid unnamed2, complete sequence",Epibacterium mobile F1926,75.9,75.9,80%,8.00E-13,28.16,147082,NZ_CP015232.1
"Mesorhizobium tamadayense strain DSM 28320 45, whole genome shotgun sequence",Mesorhizobium tamadayense,75.9,75.9,80%,8.00E-13,27.13,59658,NZ_RQXT01000045.1
"Mesorhizobium kowhaii strain Ach-343 NODE_15, whole genome shotgun sequence",Mesorhizobium kowhaii,75.9,75.9,80%,8.00E-13,27.13,130775,NZ_MZXV01000017.1
"Mesorhizobium huakuii strain 583 plasmid p_2, complete sequence",Mesorhizobium huakuii,75.9,75.9,80%,8.00E-13,27.13,331450,NZ_CP050297.1
"Rhizobium aegyptiacum strain 950 scf29_contig_2, whole genome shotgun sequence",Rhizobium aegyptiacum,75.9,75.9,80%,8.00E-13,26.34,34545,NZ_LYPM01000029.1
"Chachezhania antarctica strain SM1703 scaffold3, whole genome shotgun sequence",Chachezhania antarctica,75.5,75.5,80%,9.00E-13,28.46,419688,NZ_QZEX01000003.1
"Paracoccus contaminans strain RKI 16-01929T=LMG 29738T=CCM 8701T=CIP 111112T plasmid unnamed, complete sequence",Paracoccus contaminans,75.5,75.5,80%,9.00E-13,27.57,93982,NZ_CP020613.1
"Rhodopseudomonas rhenobacensis strain DSM 12706 Ga0415280_56, whole genome shotgun sequence",Rhodopseudomonas rhenobacensis,75.5,75.5,61%,9.00E-13,29,10664,NZ_JACHIH010000056.1
"Gemmobacter aquaticus strain A1-9 NODE_9, whole genome shotgun sequence",Gemmobacter aquaticus,75.5,75.5,80%,1.00E-12,27.64,146405,NZ_VOAK01000027.1
"Thalassobaculum fulvum strain KCTC 42651 sequence12, whole genome shotgun sequence",Thalassobaculum fulvum,75.5,75.5,90%,1.00E-12,27.03,269351,NZ_BMZS01000012.1
"Mangrovicoccus ximenensis strain T1lg56 NODE_15, whole genome shotgun sequence",Mangrovicoccus ximenensis,75.5,75.5,80%,1.00E-12,28.05,859972,NZ_QBKZ01000015.1
"Rhizobium tumorigenes strain 1078 NODE_5_length_303097_cov_29.8514_ID_9, whole genome shotgun sequence",Rhizobium tumorigenes,75.5,75.5,80%,1.00E-12,28.57,303097,NZ_PCDQ01000075.1
"Aminobacter carboxidus strain DSM 1086 Contig_11, whole genome shotgun sequence",Aminobacter carboxidus,75.5,75.5,68%,1.00E-12,30.33,132333,NZ_JACZEP010000011.1
"Methylobacterium aquaticum strain DSM 16371 contig_219, whole genome shotgun sequence",Methylobacterium aquaticum,75.5,75.5,75%,1.00E-12,28.7,19597,NZ_LABX01000219.1
"Rhizobium sullae strain HCNT1 Rsu01_trimmed__paired__merged_contig_3, whole genome shotgun sequence",Rhizobium sullae,75.5,75.5,80%,1.00E-12,26.77,888812,NZ_PIQN01000003.1
"Methylobacterium crusticola strain MIMD6 contig31, whole genome shotgun sequence",Methylobacterium crusticola,75.5,75.5,75%,1.00E-12,29.74,49828,NZ_QOWC01000031.1
"Shinella zoogloeoides strain DSM 287 5, whole genome shotgun sequence",Shinella zoogloeoides,75.5,75.5,80%,1.00E-12,27.38,251239,NZ_WUML01000005.1
"Rhizobium loessense strain CGMCC 1.3401, whole genome shotgun sequence",Rhizobium loessense,75.5,75.5,80%,1.00E-12,26.77,130887,NZ_FMTM01000014.1
"Rhizobium azibense strain 23C2 Ga0314512_109, whole genome shotgun sequence",Rhizobium azibense,75.5,75.5,80%,1.00E-12,26.77,288368,NZ_SODG01000009.1
"Gemmobacter lutimaris strain YJ-T1-11 scaffold_21, whole genome shotgun sequence",Gemmobacter lutimaris,75.1,75.1,75%,1.00E-12,29.31,59923,NZ_QXXQ01000021.1
"Rhizobium oryzae strain 1.7048 C446, whole genome shotgun sequence",Rhizobium oryzae,75.1,75.1,80%,1.00E-12,26.98,14855,NZ_MKIP01000019.1
"Methylobacterium frigidaeris strain IER25-16 C25193, whole genome shotgun sequence",Methylobacterium frigidaeris,75.1,75.1,91%,1.00E-12,26.3,4230,NZ_PELK01001288.1
"Paenimaribius caenipelagi strain JBTF-M29 contig22, whole genome shotgun sequence",Paenimaribius caenipelagi,75.1,75.1,80%,1.00E-12,28.05,54500,NZ_VFSV01000022.1
"Litoreibacter arenae DSM 19593 Contig336, whole genome shotgun sequence",Litoreibacter arenae DSM 19593,75.1,75.1,80%,1.00E-12,28.81,139962,NZ_KE557311.1
"Roseibium sediminis strain KCTC 52373 NODE_37_length_22757_cov_78.8924_ID_4110, whole genome shotgun sequence",Roseibium sediminis,75.1,75.1,80%,1.00E-12,24.4,22757,NZ_VXDB01000037.1
"Paracoccus haematequi isolate aCIP1116241, whole genome shotgun sequence",Paracoccus haematequi,75.1,75.1,80%,1.00E-12,27.76,47409,NZ_UZWE01000098.1
"Paracoccus siganidrum strain M26 Scaffold2, whole genome shotgun sequence",Paracoccus siganidrum,75.1,135,90%,1.00E-12,32.26,279237,NZ_QNRC01000002.1
"Octadecabacter temperatus strain SB1 plasmid OSB_p1, complete sequence",Octadecabacter temperatus,75.1,75.1,80%,1.00E-12,29.22,31560,NZ_CP012161.1
"Octadecabacter antarcticus 307 plasmid pOA307_63, complete sequence",Octadecabacter antarcticus 307,75.1,75.1,80%,2.00E-12,27.57,62881,NC_020907.1
"Rhodopseudomonas rhenobacensis strain DSM 12706 Ga0415280_36, whole genome shotgun sequence",Rhodopseudomonas rhenobacensis,75.1,75.1,81%,2.00E-12,27.63,51293,NZ_JACHIH010000036.1
"Rhizobium straminoryzae strain SM12 SM12_contig_38_1, whole genome shotgun sequence",Rhizobium straminoryzae,75.1,75.1,80%,2.00E-12,25.2,88846,NZ_VJMG01000038.1
"Paracoccus aminophilus JCM 7686 plasmid pAMI4, complete sequence",Paracoccus aminophilus JCM 7686,75.1,75.1,80%,2.00E-12,27.13,438126,NC_022049.1
