Description,Scientific Name,Max Score,Total Score,Query Cover,E value,Per. ident,Acc. Len,Accession  
"Johnsonella ignava ATCC 51276 supercont1.10, whole genome shotgun sequence",Johnsonella ignava ATCC 51276,240,240,89%,1.00E-69,46.69,71821,NZ_JH378838.1
"Aneurinibacillus tyrosinisolvens strain LL-002, whole genome shotgun sequence",Aneurinibacillus tyrosinisolvens,240,240,89%,1.00E-69,48.25,83396,NZ_BBWZ01000018.1
"Clostridium cylindrosporum DSM 605 CLCY_3c, whole genome shotgun sequence",Clostridium cylindrosporum DSM 605,240,240,89%,1.00E-69,45.91,312805,NZ_LFVU01000026.1
"Alkalicoccus urumqiensis strain BZ-SZ-XJ18 scaffold18, whole genome shotgun sequence",Alkalicoccus urumqiensis,240,240,89%,1.00E-69,46.69,42808,NZ_PVNS01000018.1
"Clostridium cadaveris strain LH052 isolate Clostridium cadaveris, whole genome shotgun sequence",Clostridium cadaveris,240,240,90%,1.00E-69,46.33,97776,NZ_OBJM01000014.1
"Atopobacter phocae ATCC BAA-285 L866DRAFT_scaffold00004.4_C, whole genome shotgun sequence",Atopobacter phocae ATCC BAA-285,240,240,89%,1.00E-69,49.81,59825,NZ_JAGN01000004.1
"Levilactobacillus suantsaii strain CBA3634 chromosome, complete genome",Levilactobacillus suantsaii,240,240,89%,1.00E-69,47.47,2522052,NZ_CP059603.1
"Convivina intestini strain DSM 28795 Ga0215714_109, whole genome shotgun sequence",Convivina intestini,240,240,90%,1.00E-69,48.06,64833,NZ_QEKT01000009.1
"Ruthenibacterium lactatiformans strain 585-1 contig00011, whole genome shotgun sequence",Ruthenibacterium lactatiformans,240,325,90%,2.00E-69,51.02,108630,NZ_JXXK01000011.1
"Trichococcus ilyis strain DSM 22150, whole genome shotgun sequence",Trichococcus ilyis,240,240,89%,2.00E-69,49.42,61071,NZ_FNYT01000018.1
"Gottschalkia purinilytica strain DSM 1384 CLPU_19c, whole genome shotgun sequence",Gottschalkia purinilytica,240,240,89%,2.00E-69,47.08,59919,NZ_LGSS01000019.1
"Eubacterium barkeri strain VPI 5359, whole genome shotgun sequence",Eubacterium barkeri,240,240,90%,2.00E-69,45.95,95042,NZ_FNOU01000009.1
"Thermoanaerosceptrum fracticalcis strain DRI-13 chromosome, complete genome",Thermoanaerosceptrum fracticalcis,240,240,90%,2.00E-69,47.1,3805411,NZ_CP045798.1
"Calorimonas adulescens strain A05MB NODE_24_length_37055_cov_12.169878, whole genome shotgun sequence",Calorimonas adulescens,240,240,85%,2.00E-69,49.19,37055,NZ_VTPS01000024.1
"Companilactobacillus nantensis strain NBRC 107153 sequence092, whole genome shotgun sequence",Companilactobacillus nantensis,240,240,91%,2.00E-69,48.09,14116,NZ_BJZH01000092.1
"Lacticaseibacillus jixianensis strain 159-4 contig10, whole genome shotgun sequence",Lacticaseibacillus jixianensis,240,240,90%,2.00E-69,47.31,91831,NZ_RHOJ01000010.1
"Secundilactobacillus malefermentans strain CBA3618 chromosome, complete genome",Secundilactobacillus malefermentans,240,240,89%,2.00E-69,47.27,2026419,NZ_CP042371.1
"Clostridium argentinense strain 89G, complete genome",Clostridium argentinense,240,240,91%,2.00E-69,45.04,4662988,NZ_CP014176.1
"Anaerosacchriphilus polymeriproducens strain MCWD5 MCWD5.23, whole genome shotgun sequence",Anaerosacchriphilus polymeriproducens,239,239,90%,2.00E-69,46.33,51557,NZ_QRCT01000023.1
"Marinilactibacillus piezotolerans strain DSM 16108, whole genome shotgun sequence",Marinilactibacillus piezotolerans,239,239,89%,2.00E-69,47.86,37716,NZ_FOSJ01000021.1
"Companilactobacillus huachuanensis strain 395-6.2 scaffold34, whole genome shotgun sequence",Companilactobacillus huachuanensis,239,239,91%,2.00E-69,48.09,16273,NZ_BJDF01000034.1
"Desulfocucumis palustris strain NAW-5 NODE_38, whole genome shotgun sequence",Desulfocucumis palustris,239,239,89%,2.00E-69,46.3,32010,NZ_BFAV01000038.1
"Desulfitobacterium chlororespirans DSM 11544, whole genome shotgun sequence",Desulfitobacterium chlororespirans DSM 11544,239,239,90%,2.00E-69,47.67,488857,NZ_FRDN01000006.1
"Alloiococcus otitis ATCC 51267 supercont1.2, whole genome shotgun sequence",Alloiococcus otitis ATCC 51267,239,239,89%,2.00E-69,48.83,485091,NZ_JH992958.1
"Levilactobacillus tangyuanensis strain 137-3 contig15, whole genome shotgun sequence",Levilactobacillus tangyuanensis,239,239,89%,2.00E-69,47.66,44591,NZ_RHOA01000015.1
"Clostridium peptidivorans isolate src2, whole genome shotgun sequence",Clostridium peptidivorans,239,239,90%,2.00E-69,45.17,43363,NZ_OAOD01000024.1
"Latilactobacillus sakei strain CBA3614 chromosome, complete genome",Latilactobacillus sakei,239,239,89%,2.00E-69,47.66,1944111,NZ_CP046037.1
"Lachnoanaerobaculum gingivalis strain KCOM 2030 KCOM2030_7, whole genome shotgun sequence",Lachnoanaerobaculum gingivalis,239,239,90%,2.00E-69,46.15,211772,NZ_RRCO01000007.1
"Anaerofustis stercorihominis DSM 17244 Scfld_02_4, whole genome shotgun sequence",Anaerofustis stercorihominis DSM 17244,239,239,90%,2.00E-69,45.95,1288597,NZ_DS560019.1
"Desulfitobacterium dichloroeliminans LMG P-21439, complete sequence",Desulfitobacterium dichloroeliminans LMG P-21439,239,239,90%,2.00E-69,47.1,3624449,NC_019903.1
"Eggerthia catenaformis OT 569 = DSM 20559 strain OT 569 acdBZ-supercont1.6, whole genome shotgun sequence",Eggerthia catenaformis OT 569 = DSM 20559,239,239,90%,2.00E-69,47.69,53733,NZ_KB446651.1
"Clostridium chromiireducens strain C1 Scaffold11, whole genome shotgun sequence",Clostridium chromiireducens,239,239,90%,2.00E-69,46.72,84152,NZ_QXDJ01000011.1
"Bacillus aquimaris TF-12 strain TF12 Cont44, whole genome shotgun sequence",Bacillus aquimaris TF-12,239,239,89%,2.00E-69,47.27,291220,NZ_LQXM01000025.1
"Blautia hydrogenotrophica strain 2789STDY5608857, whole genome shotgun sequence",Blautia hydrogenotrophica,239,239,90%,2.00E-69,47.88,503423,NZ_CYXL01000003.1
"Lactobacillus saniviri JCM 17471 = DSM 24301 NODE_47, whole genome shotgun sequence",Lactobacillus saniviri JCM 17471 = DSM 24301,239,239,89%,2.00E-69,48.25,167525,NZ_JQCE01000038.1
"Lactobacillus parabrevis ATCC 53295 Scaffold23, whole genome shotgun sequence",Lactobacillus parabrevis ATCC 53295,239,239,89%,2.00E-69,47.66,41095,NZ_AZCZ01000023.1
"Companilactobacillus halodurans strain TMW 1.1920 seq28, whole genome shotgun sequence",Companilactobacillus halodurans,239,239,91%,2.00E-69,47.71,40898,NZ_VDFO01000028.1
"Companilactobacillus heilongjiangensis strain DSM 28069 chromosome, complete genome",Companilactobacillus heilongjiangensis,239,239,91%,2.00E-69,48.09,2790548,NZ_CP012559.1
"Trichococcus flocculiformis strain DSM 2094, whole genome shotgun sequence",Trichococcus flocculiformis,239,239,89%,3.00E-69,49.42,65005,NZ_FOQC01000011.1
"Companilactobacillus zhachilii strain HBUAS52074 chromosome, complete genome",Companilactobacillus zhachilii,239,239,91%,3.00E-69,48.09,2714973,NZ_CP031933.2
"Pectinatus haikarae strain MB233 12.1, whole genome shotgun sequence",Pectinatus haikarae,239,239,85%,3.00E-69,46.94,591163,NZ_WIQM01000008.1
"Desmospora activa DSM 45169 Ga0192300_102, whole genome shotgun sequence",Desmospora activa DSM 45169,239,239,85%,3.00E-69,48.16,569576,NZ_PZZP01000002.1
"Lawsonibacter asaccharolyticus strain 3BBH22, whole genome shotgun sequence",Lawsonibacter asaccharolyticus,239,627,91%,3.00E-69,50.78,3503692,NZ_BFBT01000001.1
"Carboxydothermus pertinax strain Ug1, whole genome shotgun sequence",Carboxydothermus pertinax,239,239,90%,3.00E-69,47.88,144768,NZ_BDJK01000009.1
"Butyricicoccus pullicaecorum isolate Butyricicoccus pullicaecorum_25.3(T), whole genome shotgun sequence",Butyricicoccus pullicaecorum,239,239,90%,3.00E-69,45.95,549166,NZ_FRDE01000005.1
"Ligilactobacillus salitolerans strain YK43 sequence037, whole genome shotgun sequence",Ligilactobacillus salitolerans,239,239,89%,3.00E-69,50.39,26510,NZ_BFFP01000037.1
"Levilactobacillus yonginensis strain JCM 18023 contig13, whole genome shotgun sequence",Levilactobacillus yonginensis,239,239,89%,3.00E-69,47.27,74730,NZ_RHNO01000013.1
"Levilactobacillus tongjiangensis strain 218-10 contig4, whole genome shotgun sequence",Levilactobacillus tongjiangensis,239,239,89%,3.00E-69,47.27,183112,NZ_RHNY01000004.1
"Levilactobacillus huananensis strain 151-2B contig4, whole genome shotgun sequence",Levilactobacillus huananensis,239,239,89%,3.00E-69,47.66,199066,NZ_RHOC01000004.1
"Lactobacillus oeni DSM 19972 NODE_59, whole genome shotgun sequence",Lactobacillus oeni DSM 19972,239,239,89%,3.00E-69,48.83,213413,NZ_AZEH01000025.1
"Atopostipes suicloacalis DSM 15692, whole genome shotgun sequence",Atopostipes suicloacalis DSM 15692,239,239,90%,3.00E-69,47.88,80861,NZ_FQUF01000008.1
"Companilactobacillus metriopterae strain JCM 31635 contig3, whole genome shotgun sequence",Companilactobacillus metriopterae,239,239,89%,3.00E-69,47.66,219921,NZ_RSTD01000003.1
"Lactobacillus terrae strain NIBRBAC000499792 chromosome, complete genome",Lactobacillus terrae,239,239,89%,3.00E-69,47.66,1548794,NZ_CP024610.1
"Halarsenatibacter silvermanii strain SLAS-1, whole genome shotgun sequence",Halarsenatibacter silvermanii,239,239,89%,3.00E-69,46.3,69058,NZ_FNGO01000015.1
"Inediibacterium massiliense strain Mt12, whole genome shotgun sequence",Inediibacterium massiliense,239,239,89%,3.00E-69,46.3,296276,NZ_LN876584.1
"Levilactobacillus spicheri strain LP38 contig3, whole genome shotgun sequence",Levilactobacillus spicheri,239,239,89%,3.00E-69,47.27,228460,NZ_JZCR01000003.1
"Clostridium phoceensis strain GD3, whole genome shotgun sequence",Clostridium phoceensis,239,385,90%,3.00E-69,50.78,3279315,NZ_LN866274.1
"Lactobacillus camelliae DSM 22697 = JCM 13995 strain DSM 22697 NODE_7, whole genome shotgun sequence",Lactobacillus camelliae DSM 22697 = JCM 13995,239,239,90%,3.00E-69,46.92,39021,NZ_AYZJ01000003.1
"Clostridium tyrobutyricum strain KCTC 5387, complete sequence",Clostridium tyrobutyricum,239,239,91%,3.00E-69,45.21,3071606,NZ_CP014170.1
"Oribacterium asaccharolyticum ACB7 supercont1.4, whole genome shotgun sequence",Oribacterium asaccharolyticum ACB7,239,239,90%,3.00E-69,48.26,88312,NZ_JH414507.1
"Lapidilactobacillus mulanensis strain 143-6 contig14, whole genome shotgun sequence",Lapidilactobacillus mulanensis,239,239,90%,3.00E-69,47.31,56895,NZ_RHOW01000014.1
"Lactobacillus farciminis KCTC 3681 = DSM 20184, complete genome",Lactobacillus farciminis KCTC 3681 = DSM 20184,239,478,91%,4.00E-69,47.33,2551839,NZ_CP017702.1
"Lacticaseibacillus rhamnosus strain UMB0004 ERR1203597.17957_1_9.2, whole genome shotgun sequence",Lacticaseibacillus rhamnosus,239,239,90%,4.00E-69,46.54,489262,NZ_PKJX01000002.1
"Clostridium collagenovorans DSM 3089, whole genome shotgun sequence",Clostridium collagenovorans DSM 3089,239,239,90%,4.00E-69,46.33,70954,NZ_FQXP01000014.1
"Intestinimonas butyriciproducens strain 27-5-10 unitig_0, whole genome shotgun sequence",Intestinimonas butyriciproducens,239,239,90%,4.00E-69,47.49,3188067,NZ_MJII01000001.1
"Companilactobacillus jidongensis strain 204-8 contig5, whole genome shotgun sequence",Companilactobacillus jidongensis,239,239,91%,4.00E-69,47.71,207488,NZ_RHOP01000005.1
"Levilactobacillus fuyuanensis strain 244-4 contig18, whole genome shotgun sequence",Levilactobacillus fuyuanensis,239,239,89%,4.00E-69,47.66,63134,NZ_RHNZ01000018.1
"Clostridium niameyense strain MT5, whole genome shotgun sequence",Clostridium niameyense,239,239,90%,4.00E-69,47.69,128509,NZ_LN849006.1
"Agathobaculum butyriciproducens strain DSM 100391 Ga0215719_105, whole genome shotgun sequence",Agathobaculum butyriciproducens,239,239,90%,4.00E-69,46.33,145388,NZ_QEKJ01000005.1
"Proteiniclasticum ruminis strain CGMCC 1.5058, whole genome shotgun sequence",Proteiniclasticum ruminis,239,239,90%,4.00E-69,46.33,361813,NZ_FNDZ01000003.1
"Lactobacillus aquaticus DSM 21051 NODE_15, whole genome shotgun sequence",Lactobacillus aquaticus DSM 21051,239,239,89%,4.00E-69,49.61,346600,NZ_AYZD01000011.1
Dolosigranulum pigrum strain KPL1914 chromosome,Dolosigranulum pigrum,239,239,89%,4.00E-69,47.86,1890416,NZ_CP040938.1
"Tepidibacter mesophilus strain JCM 16806, whole genome shotgun sequence",Tepidibacter mesophilus,239,239,89%,4.00E-69,46.3,109398,NZ_BDQY01000008.1
"Clostridium taeniosporum strain 1/k chromosome, complete genome",Clostridium taeniosporum,239,239,91%,4.00E-69,46.18,3264813,NZ_CP017253.2
"Mediterraneibacter butyricigenes strain KCTC 15684 Contigs1, whole genome shotgun sequence",Mediterraneibacter butyricigenes,239,926,91%,4.00E-69,45.17,2916053,NZ_BHGK01000001.1
"Acetobacterium woodii DSM 1030, complete sequence",Acetobacterium woodii DSM 1030,239,384,90%,4.00E-69,45.56,4044777,NC_016894.1
"Blautia glucerasea strain MSK.21.93 NODE_14_length_83214_cov_180.532, whole genome shotgun sequence",Blautia glucerasea,239,377,90%,4.00E-69,46.72,83214,NZ_JAAITU010000014.1
"Weissella thailandensis strain JCM 10695 scaffold13, whole genome shotgun sequence",Weissella thailandensis,239,239,89%,4.00E-69,48.44,65154,NZ_BJEC01000013.1
"Lactobacillus uvarum DSM 19971 Scaffold40, whole genome shotgun sequence",Lactobacillus uvarum DSM 19971,239,239,89%,5.00E-69,49.61,12123,NZ_AZEG01000040.1
"Weissella jogaejeotgali strain FOL01, complete sequence",Weissella jogaejeotgali,239,362,89%,5.00E-69,49.22,2114163,NZ_CP014332.1
"Natribacillus halophilus strain DSM 21771, whole genome shotgun sequence",Natribacillus halophilus,239,239,89%,5.00E-69,46.3,419186,NZ_FNEN01000002.1
"Companilactobacillus formosensis strain S215 Scaffold1, whole genome shotgun sequence",Companilactobacillus formosensis,239,239,91%,5.00E-69,47.33,694203,NZ_QWDI01000001.1
"Lactobacillus thailandensis DSM 22698 = JCM 13996 strain DSM 22698 Scaffold3, whole genome shotgun sequence",Lactobacillus thailandensis DSM 22698 = JCM 13996,239,239,89%,5.00E-69,48.05,275795,NZ_AYZK01000003.1
"Acidaminococcus massiliensis strain Marseille-P2828, whole genome shotgun sequence",Acidaminococcus massiliensis,238,238,90%,5.00E-69,46.72,2625322,NZ_LT608315.1
"Companilactobacillus keshanensis strain 33-7 contig1, whole genome shotgun sequence",Companilactobacillus keshanensis,238,238,91%,5.00E-69,47.71,262009,NZ_RHOS01000001.1
"Weissella halotolerans DSM 20190 G414DRAFT_scaffold00002.2_C, whole genome shotgun sequence",Weissella halotolerans DSM 20190,238,238,89%,5.00E-69,50,412519,NZ_ATUU01000002.1
"Intestinimonas timonensis strain GD4, whole genome shotgun sequence",Intestinimonas timonensis,238,300,90%,5.00E-69,48.26,1194504,NZ_LR130816.1
"Companilactobacillus suantsaicola strain BCRC 81127 Scaffold23_1, whole genome shotgun sequence",Companilactobacillus suantsaicola,238,238,91%,6.00E-69,47.33,42972,NZ_RKLY01000023.1
"Companilactobacillus futsaii strain Y97 chromosome, complete genome",Companilactobacillus futsaii,238,238,91%,6.00E-69,47.33,2558218,NZ_CP040736.1
"Lactobacillus nodensis DSM 19682 = JCM 14932 = NBRC 107160, whole genome shotgun sequence",Lactobacillus nodensis DSM 19682 = JCM 14932 = NBRC 107160,238,238,91%,6.00E-69,47.71,314092,NZ_BCWC01000003.1
"Clostridium isatidis strain DSM 15098, complete genome",Clostridium isatidis,238,238,90%,6.00E-69,48.26,2869927,NZ_CP016786.1
"Clostridium rectalis strain Marseille-P4200, whole genome shotgun sequence",Clostridium rectalis,238,238,90%,6.00E-69,46.33,170542,NZ_UYZZ01000007.1
"Lactobacillus senmaizukei DSM 21775 = NBRC 103853, whole genome shotgun sequence",Lactobacillus senmaizukei DSM 21775 = NBRC 103853,238,238,89%,7.00E-69,47.27,143849,NZ_BCWD01000002.1
"Desulfotomaculum arcticum DSM 17038, whole genome shotgun sequence",Desulfotomaculum arcticum DSM 17038,238,238,89%,7.00E-69,47.08,181791,NZ_FOOX01000011.1
"Enterococcus timonensis strain Marseille-P2817T, whole genome shotgun sequence",Enterococcus timonensis,238,238,90%,7.00E-69,47.49,575081,NZ_FNVY01000003.1
"[Clostridium] populeti strain 743A, whole genome shotgun sequence",[Clostridium] populeti,238,238,91%,7.00E-69,45.04,64537,NZ_FOYZ01000018.1
"Mobilisporobacter senegalensis strain DSM 26537 Ga0244700_116, whole genome shotgun sequence",Mobilisporobacter senegalensis,238,238,90%,7.00E-69,45.56,54260,NZ_RJVG01000016.1
"Harryflintia acetispora strain DSM 100433 Ga0244721_101, whole genome shotgun sequence",Harryflintia acetispora,238,238,89%,7.00E-69,48.25,544752,NZ_SLUK01000001.1
"Provencibacterium massiliense strain Marseille-P2780, whole genome shotgun sequence",Provencibacterium massiliense,238,238,89%,7.00E-69,48.25,2015177,NZ_FWCH01000012.1
"Companilactobacillus crustorum strain MN047, complete sequence",Companilactobacillus crustorum,238,238,91%,7.00E-69,46.95,2261471,NZ_CP017996.1
"Clostridium frigidicarnis strain DSM 12271, whole genome shotgun sequence",Clostridium frigidicarnis,238,238,90%,8.00E-69,46.72,45436,NZ_FOKI01000029.1
"Latilactobacillus graminis strain LG542 chromosome, complete genome",Latilactobacillus graminis,238,238,89%,8.00E-69,46.48,1807083,NZ_CP045007.1
"Pseudoramibacter alactolyticus ATCC 23263 SCAFFOLD1, whole genome shotgun sequence",Pseudoramibacter alactolyticus ATCC 23263,238,348,91%,8.00E-69,46.33,2333363,NZ_GL622359.1
"Weissella ceti NC36 contig_6, whole genome shotgun sequence",Weissella ceti NC36,238,238,89%,8.00E-69,49.61,385673,NZ_ANCA01000006.1
"Clostridium paraputrificum AGR2156 G594DRAFT_scaffold00012.12_C, whole genome shotgun sequence",Clostridium paraputrificum AGR2156,238,238,90%,8.00E-69,46.72,74002,NZ_AUJC01000014.1
"Levilactobacillus cerevisiae strain DSM 100836 contig26, whole genome shotgun sequence",Levilactobacillus cerevisiae,238,238,89%,8.00E-69,47.27,46812,NZ_RHNN01000026.1
"Jeotgalibaca arthritidis strain CECT 9157 chromosome, complete genome",Jeotgalibaca arthritidis,238,398,90%,9.00E-69,48.64,2348096,NZ_CP049740.1
"Centipeda periodontii DSM 2778 SCAFFOLD1, whole genome shotgun sequence",Centipeda periodontii DSM 2778,238,308,90%,9.00E-69,50.19,2749943,NZ_GL892076.1
"Clostridium tetanomorphum strain DJ062 Ga0423206_01, whole genome shotgun sequence",Clostridium tetanomorphum,238,238,90%,9.00E-69,47.49,4490777,NZ_JABSWD010000001.1
"Anaerotignum neopropionicum strain DSM-3847 CLNEO_contig000001, whole genome shotgun sequence",Anaerotignum neopropionicum,238,373,90%,9.00E-69,45.95,734541,NZ_LRVM01000001.1
"Anaeroglobus geminatus F0357 Scfld0, whole genome shotgun sequence",Anaeroglobus geminatus F0357,238,238,90%,9.00E-69,48.26,58392,NZ_JH417560.1
"Bacillus enclensis strain SGD-1123, whole genome shotgun sequence",Bacillus enclensis,238,238,89%,9.00E-69,46.69,104307,NZ_FMAU01000007.1
"Enterocloster lavalensis isolate MGYG-HGUT-00172, whole genome shotgun sequence",Enterocloster lavalensis,238,238,90%,9.00E-69,45.56,25513,NZ_CABJCG010000036.1
"Enterocloster asparagiformis strain AF04-15 AF04-15.Scaf37, whole genome shotgun sequence",Enterocloster asparagiformis,238,238,90%,9.00E-69,45.56,26733,NZ_QSBM01000037.1
"Marinilactibacillus psychrotolerans strain NBRC 100002 sequence08, whole genome shotgun sequence",Marinilactibacillus psychrotolerans,238,238,89%,9.00E-69,47.47,101289,NZ_BJVX01000008.1
"Aquisalibacillus elongatus strain DSM 18090 Ga0244676_105, whole genome shotgun sequence",Aquisalibacillus elongatus,238,238,89%,9.00E-69,48.64,203083,NZ_RKRF01000011.1
"Massilimicrobiota timonensis strain An13 An13_contig_65, whole genome shotgun sequence",Massilimicrobiota timonensis,238,238,90%,1.00E-68,48.65,6756,NZ_NFLJ01000065.1
"Desulfitobacterium metallireducens DSM 15288 chromosome, complete genome",Desulfitobacterium metallireducens DSM 15288,238,318,91%,1.00E-68,45.04,3176073,NZ_CP007032.1
"Lactobacillus pantheris DSM 15945 = JCM 12539 = NBRC 106106, whole genome shotgun sequence",Lactobacillus pantheris DSM 15945 = JCM 12539 = NBRC 106106,238,238,89%,1.00E-68,47.66,5778,NZ_BCVS01000130.1
"Amylolactobacillus amylotrophicus DSM 20534 Scaffold3, whole genome shotgun sequence",Amylolactobacillus amylotrophicus DSM 20534,238,238,89%,1.00E-68,47.27,122117,NZ_AZCV01000003.1
"Selenomonas felix strain Marseille-P3560, whole genome shotgun sequence",Selenomonas felix,238,238,90%,1.00E-68,50.19,288510,NZ_LT891956.1
"Amylolactobacillus amylophilus DSM 20533 = JCM 1125 strain DSM 20533 chromosome, complete genome",Amylolactobacillus amylophilus DSM 20533 = JCM 1125,238,238,89%,1.00E-68,47.27,1610352,NZ_CP018888.1
"Companilactobacillus alimentarius strain NBRC 106464 sequence06, whole genome shotgun sequence",Companilactobacillus alimentarius,238,238,91%,1.00E-68,46.95,207292,NZ_BJZA01000006.1
"Aneurinibacillus migulanus strain DSM 2895 super9, whole genome shotgun sequence",Aneurinibacillus migulanus,238,238,89%,1.00E-68,48.64,228764,NZ_LGUG01000005.1
"Eubacterium oxidoreducens strain DSM 3217, whole genome shotgun sequence",Eubacterium oxidoreducens,238,238,89%,1.00E-68,47.08,26317,NZ_FMXR01000024.1
"Tepidibacter formicigenes DSM 15518, whole genome shotgun sequence",Tepidibacter formicigenes DSM 15518,238,238,89%,1.00E-68,46.3,29501,NZ_FRAE01000029.1
"Eubacterium aggregans strain SR12, whole genome shotgun sequence",Eubacterium aggregans,238,238,90%,1.00E-68,45.56,218685,NZ_FNRK01000001.1
"Bacillus polygoni strain CCTCC AB 2014251 Scaffold1, whole genome shotgun sequence",Bacillus polygoni,238,238,89%,1.00E-68,47.47,5085045,NZ_KZ119601.1
"Clostridium oryzae strain DSM 28571 CLORY_contig000053, whole genome shotgun sequence",Clostridium oryzae,238,238,90%,1.00E-68,45.17,26931,NZ_MZGV01000053.1
"Cellulosilyticum lentocellum DSM 5427, complete sequence",Cellulosilyticum lentocellum DSM 5427,238,409,90%,1.00E-68,47.1,4714237,NC_015275.1
"Jeotgalibaca dankookensis strain EX-07 chromosome, complete genome",Jeotgalibaca dankookensis,238,238,89%,1.00E-68,48.25,2096058,NZ_CP019728.1
"Companilactobacillus insicii strain DSM 29801 contig13, whole genome shotgun sequence",Companilactobacillus insicii,238,238,91%,1.00E-68,47.33,64974,NZ_RHNU01000013.1
"Heliophilum fasciatum strain DSM 11170 Ga0244663_114, whole genome shotgun sequence",Heliophilum fasciatum,238,238,88%,1.00E-68,47.43,76714,NZ_SLXT01000014.1
"Clostridium disporicum strain 2789STDY5834856, whole genome shotgun sequence",Clostridium disporicum,238,238,90%,1.00E-68,47.1,83368,NZ_CYZX01000016.1
"Companilactobacillus nuruki strain SYF10-1a, whole genome shotgun sequence",Companilactobacillus nuruki,238,238,91%,1.00E-68,46.95,181756,NZ_NIPR01000001.1
"Fructobacillus tropaeoli strain CRL 2034 contig001, whole genome shotgun sequence",Fructobacillus tropaeoli,238,238,89%,1.00E-68,47.47,1007334,NZ_WNLV01000005.1
"Clostridium cagae strain Marseille-P4344, whole genome shotgun sequence",Clostridium cagae,237,237,91%,1.00E-68,46.18,86243,NZ_OKRA01000004.1
"Companilactobacillus hulinensis strain 8-1(1) contig3, whole genome shotgun sequence",Companilactobacillus hulinensis,237,237,91%,1.00E-68,47.33,200089,NZ_RHOO01000003.1
"Herbinix hemicellulosilytica isolate T3/55T, whole genome shotgun sequence",Herbinix hemicellulosilytica,237,237,89%,1.00E-68,45.91,104261,NZ_CVTD020000027.1
"Levilactobacillus mulengensis strain 112-3 contig2, whole genome shotgun sequence",Levilactobacillus mulengensis,237,237,89%,1.00E-68,46.88,369699,NZ_RHNW01000002.1
"Salisediminibacterium haloalkalitolerans strain 10nlg, whole genome shotgun sequence",Salisediminibacterium haloalkalitolerans,237,237,89%,1.00E-68,47.86,21074,NZ_FOGV01000036.1
"Hathewaya massiliensis strain Marseille-P3545, whole genome shotgun sequence",Hathewaya massiliensis,237,237,91%,1.00E-68,46.95,1117708,NZ_CABFVD010000001.1
"Lactobacillus hammesii DSM 16381 NODE_77, whole genome shotgun sequence",Lactobacillus hammesii DSM 16381,237,237,89%,1.00E-68,47.27,71308,NZ_AZFS01000041.1
"Desulfallas thermosapovorans DSM 6562 Ga0056077_scaffold00004.4, whole genome shotgun sequence",Desulfallas thermosapovorans DSM 6562,237,237,89%,2.00E-68,47.47,226111,NZ_VNHM01000004.1
"Bacillus chagannorensis DSM 18086 G477DRAFT_scaffold00006.6_C, whole genome shotgun sequence",Bacillus chagannorensis DSM 18086,237,237,89%,2.00E-68,47.47,163312,NZ_AUCK01000007.1
"Levilactobacillus lindianensis strain 220-4 contig29, whole genome shotgun sequence",Levilactobacillus lindianensis,237,237,89%,2.00E-68,47.27,21864,NZ_RHOD01000029.1
"Clostridium saccharobutylicum DSM 13864, complete sequence",Clostridium saccharobutylicum DSM 13864,237,331,90%,2.00E-68,45.95,5107814,NC_022571.1
"Levilactobacillus paucivorans strain DSM 22467 NODE_6, whole genome shotgun sequence",Levilactobacillus paucivorans,237,237,89%,2.00E-68,47.27,78760,NZ_JQCA01000004.1
"Lapidilactobacillus dextrinicus strain LH506 chromosome, complete genome",Lapidilactobacillus dextrinicus,237,237,89%,2.00E-68,47.47,1836976,NZ_CP044499.1
"Subdoligranulum variabile DSM 15176 Scfld2, whole genome shotgun sequence",Subdoligranulum variabile DSM 15176,237,237,89%,2.00E-68,48.25,367229,NZ_GG704771.1
"Companilactobacillus mindensis strain NBRC 107162 sequence028, whole genome shotgun sequence",Companilactobacillus mindensis,237,237,91%,2.00E-68,47.33,23941,NZ_BJZN01000028.1
"Acetanaerobacterium elongatum strain CGMCC 1.5012, whole genome shotgun sequence",Acetanaerobacterium elongatum,237,237,90%,2.00E-68,49.22,41100,NZ_FNID01000028.1
"Lachnoanaerobaculum orale strain DSM 24553 DSM24553_2, whole genome shotgun sequence",Lachnoanaerobaculum orale,237,237,90%,2.00E-68,45.38,403406,NZ_RRCM01000002.1
"Blautia marasmi isolate MGYG-HGUT-02437, whole genome shotgun sequence",Blautia marasmi,237,237,90%,2.00E-68,47.1,527667,NZ_CABMKU010000004.1
"Blautia hominis strain KB1 KB1_contig4, whole genome shotgun sequence",Blautia hominis,237,237,90%,2.00E-68,47.1,527667,NZ_NQOF01000004.1
"Ruminococcus gauvreauii isolate MGYG-HGUT-01690, whole genome shotgun sequence",Ruminococcus gauvreauii,237,237,90%,2.00E-68,47.49,120194,NZ_CABLBR010000009.1
"Bacillus vietnamensis NBRC 101237, whole genome shotgun sequence",Bacillus vietnamensis NBRC 101237,237,237,89%,2.00E-68,47.08,26661,NZ_BCVQ01000050.1
"Selenomonas massiliensis strain Marseille-P4036, whole genome shotgun sequence",Selenomonas massiliensis,237,237,90%,2.00E-68,50.19,1219349,NZ_LT985754.1
