Description,Scientific Name,Max Score,Total Score,Query Cover,E value,Per. ident,Acc. Len,Accession  
"Salinibacillus xinjiangensis strain J4 scaffold14:size72697, whole genome shotgun sequence",Salinibacillus xinjiangensis,251,251,89%,3.00E-73,49.81,72697,NZ_WJNH01000014.1
"[Clostridium] aerotolerans DSM 5434 T546DRAFT_scaffold00017.17_C, whole genome shotgun sequence",[Clostridium] aerotolerans DSM 5434,251,251,90%,3.00E-73,47.49,115960,NZ_JHWJ01000017.1
"Tetragenococcus koreensis strain NBRC 106072 sequence002, whole genome shotgun sequence",Tetragenococcus koreensis,251,251,90%,3.00E-73,49.42,140700,NZ_BJYN01000002.1
"Paenibacillus dakarensis strain FF9, whole genome shotgun sequence",Paenibacillus dakarensis,251,251,89%,3.00E-73,48.64,52963,NZ_CDSE01000090.1
"Enterococcus wangshanyuanii strain MN05 chromosome, complete genome",Enterococcus wangshanyuanii,251,251,89%,3.00E-73,50.58,3842361,NZ_CP021874.1
"Veillonella rogosae JCM 15642 Contig_10_len_561265, whole genome shotgun sequence",Veillonella rogosae JCM 15642,251,251,90%,3.00E-73,50.78,561265,NZ_PPCX01000010.1
"Lysinibacillus xylanilyticus strain DSM 23493 Scaffold3, whole genome shotgun sequence",Lysinibacillus xylanilyticus,251,251,90%,3.00E-73,48.84,490472,NZ_LFXJ01000002.1
"Cohnella endophytica strain M2MS4P-1 Scaffold5_1, whole genome shotgun sequence",Cohnella endophytica,251,251,89%,3.00E-73,49.03,501394,NZ_RBZM01000007.1
"Paenibacillus whitsoniae strain MER 54 contig_73, whole genome shotgun sequence",Paenibacillus whitsoniae,251,251,89%,3.00E-73,49.03,60252,NZ_RXHU01000073.1
"Tepidanaerobacter acetatoxydans Re1, complete sequence",Tepidanaerobacter acetatoxydans Re1,251,251,89%,3.00E-73,48.46,2759867,NC_015519.1
Bacillus gobiensis strain FJAT-4402 chromosome,Bacillus gobiensis,251,251,89%,3.00E-73,48.83,4597707,NZ_CP012600.1
"Staphylospora marina strain SCSIO 07575 chromosome, complete genome",Staphylospora marina,251,251,89%,3.00E-73,48.64,2706111,NZ_CP034118.1
"Natranaerobius thermophilus JW/NM-WN-LF, complete sequence",Natranaerobius thermophilus JW/NM-WN-LF,251,251,89%,3.00E-73,50.19,3165557,NC_010718.1
"Virgibacillus necropolis strain LMG 19488 chromosome, complete genome",Virgibacillus necropolis,251,251,89%,3.00E-73,49.42,4337422,NZ_CP022437.1
"Paenibacillus koleovorans NBRC 103111 PKO02S_CON000107, whole genome shotgun sequence",Paenibacillus koleovorans NBRC 103111,250,250,89%,3.00E-73,48.64,23948,NZ_BIMA01000107.1
"Bacillus akibai JCM 9157, whole genome shotgun sequence",Bacillus akibai JCM 9157,251,251,89%,3.00E-73,48.64,139054,NZ_BAUV01000008.1
"Roseburia faecis strain 2789STDY5608863, whole genome shotgun sequence",Roseburia faecis,250,250,90%,3.00E-73,49.42,27544,NZ_CYXV01000022.1
"Cuneatibacter caecimuris strain DSM 29486 Ga0310506_104, whole genome shotgun sequence",Cuneatibacter caecimuris,250,250,90%,3.00E-73,47.88,319126,NZ_SGXF01000004.1
"Bacillus dielmoensis isolate FF4, whole genome shotgun sequence",Bacillus dielmoensis,250,250,89%,3.00E-73,48.25,141780,NZ_HG942085.1
"[Clostridium] scindens ATCC 35704 chromosome, complete genome",[Clostridium] scindens ATCC 35704,250,483,90%,3.00E-73,47.1,3658040,NZ_CP036170.1
"Loigolactobacillus zhaoyuanensis strain 187-3 contig10, whole genome shotgun sequence",Loigolactobacillus zhaoyuanensis,250,250,89%,3.00E-73,49.81,61970,NZ_RHOE01000010.1
"Cytobacillus oceanisediminis strain CGMCC 1.10115 IQ19DRAFT_scaffold00016.16, whole genome shotgun sequence",Cytobacillus oceanisediminis,250,250,89%,4.00E-73,48.64,117952,NZ_VLKI01000016.1
"Fictibacillus solisalsi strain CGMCC 1.6854, whole genome shotgun sequence",Fictibacillus solisalsi,250,250,90%,4.00E-73,48.08,33359,NZ_FNHW01000011.1
"Defluviitalea phaphyphila strain Alg1 scaffold11, whole genome shotgun sequence",Defluviitalea phaphyphila,250,250,90%,4.00E-73,48.26,120509,NZ_JWID01000011.1
"Parageobacillus caldoxylosilyticus CIC9 contig37, whole genome shotgun sequence",Parageobacillus caldoxylosilyticus CIC9,250,250,90%,4.00E-73,49.42,43757,NZ_AMRO01000030.1
"Bacillus ndiopicus isolate FF3, whole genome shotgun sequence",Bacillus ndiopicus,250,250,90%,4.00E-73,48.45,206824,NZ_HG964409.1
"Caldanaerobius polysaccharolyticus DSM 13641 CalpoDRAFT_CPK.3, whole genome shotgun sequence",Caldanaerobius polysaccharolyticus DSM 13641,250,250,90%,4.00E-73,47.1,1226319,NZ_KE386495.1
"Carboxydocella sporoproducens DSM 16521, whole genome shotgun sequence",Carboxydocella sporoproducens DSM 16521,250,250,90%,4.00E-73,49.42,25932,NZ_FUXM01000034.1
"Virgibacillus halodenitrificans strain PDB-F2 chromosome, complete genome",Virgibacillus halodenitrificans,250,380,89%,4.00E-73,49.42,3869935,NZ_CP017962.1
"Bacillus shackletonii strain LMG 18435 super19, whole genome shotgun sequence",Bacillus shackletonii,250,250,89%,4.00E-73,49.61,725460,NZ_LJJC01000006.1
"Halolactibacillus halophilus strain DSM 17073, whole genome shotgun sequence",Halolactibacillus halophilus,250,250,89%,4.00E-73,49.42,37347,NZ_FOXC01000027.1
"Paenibacillus mesophilus strain SYSU K30004 Scaffold10, whole genome shotgun sequence",Paenibacillus mesophilus,250,250,90%,4.00E-73,48.08,293729,NZ_VCRA01000010.1
"Cytobacillus praedii strain FJAT-25547 Contig18, whole genome shotgun sequence",Cytobacillus praedii,250,250,89%,4.00E-73,49.42,34941,NZ_LMBX01000040.1
"Lysinibacillus tabacifolii strain KCTC 33042 contig_7__1..190389_, whole genome shotgun sequence",Lysinibacillus tabacifolii,250,250,90%,4.00E-73,48.84,190389,NZ_SZPT01000007.1
"Lysinibacillus mangiferihumi strain M-GX18 NODE_6_length_202715_cov_12.1773_ID_11, whole genome shotgun sequence",Lysinibacillus mangiferihumi,250,250,90%,4.00E-73,48.84,202715,NZ_PYWM01000006.1
"Lysinibacillus varians strain GY32 chromosome, complete genome",Lysinibacillus varians,250,355,91%,4.00E-73,48.84,4662822,NZ_CP006837.1
"Lysinibacillus sphaericus strain DSM 28 chromosome, complete genome",Lysinibacillus sphaericus,250,250,90%,4.00E-73,48.84,4681723,NZ_CP019980.1
"Bacillus niameyensis strain SIT3, whole genome shotgun sequence",Bacillus niameyensis,250,250,89%,4.00E-73,50,4669777,NZ_LN831197.1
"Apilactobacillus ozensis DSM 23829 = JCM 17196 strain DSM 23829 NODE_98, whole genome shotgun sequence",Apilactobacillus ozensis DSM 23829 = JCM 17196,250,250,89%,4.00E-73,50,85767,NZ_AYYQ01000030.1
"Pelotomaculum propionicicum strain MGP Pmgp_1, whole genome shotgun sequence",Pelotomaculum propionicicum,250,250,89%,4.00E-73,48.64,202536,NZ_QFFZ01000001.1
"Paenibacillus yonginensis strain DCY84, complete sequence",Paenibacillus yonginensis,250,250,89%,4.00E-73,49.81,4985901,NZ_CP014167.1
"Falsibacillus albus strain GY 10110 Scaffold11, whole genome shotgun sequence",Falsibacillus albus,250,250,89%,4.00E-73,48.64,178939,NZ_RCVZ01000011.1
"Tetragenococcus halophilus NBRC 12172, complete sequence",Tetragenococcus halophilus NBRC 12172,250,250,91%,4.00E-73,48.09,2562720,NC_016052.1
"Neobacillus novalis strain FJAT-14227 Scaffold1, whole genome shotgun sequence",Neobacillus novalis,250,250,89%,4.00E-73,49.42,5667584,NZ_KV440951.1
"Bacillus aurantiacus DSM 18675 G476DRAFT_scaffold00003.3, whole genome shotgun sequence",Bacillus aurantiacus DSM 18675,250,250,89%,4.00E-73,49.81,500399,NZ_KE386943.1
"Thermoanaerobacter kivui strain LKT-1 chromosome, complete genome",Thermoanaerobacter kivui,250,250,91%,4.00E-73,48.47,2397824,NZ_CP009170.1
"Carnobacterium inhibens subsp. inhibens DSM 13024 strain K1 BR65DRAFT_scf7180000000016_quiver.6_C, whole genome shotgun sequence",Carnobacterium inhibens subsp. inhibens DSM 13024,250,250,89%,4.00E-73,48.64,2547565,NZ_JQIV01000006.1
"Virgibacillus ndiopensis strain Marseille-P3835, whole genome shotgun sequence",Virgibacillus ndiopensis,250,250,89%,4.00E-73,48.64,1419464,NZ_FZMZ01000006.1
"Thermoactinomyces vulgaris strain 2H chromosome, complete genome",Thermoactinomyces vulgaris,250,250,89%,4.00E-73,50.19,2619280,NZ_CP039710.1
"Lactobacillus murinus DSM 20452 = NBRC 14221 strain DSM 20452 NODE_193, whole genome shotgun sequence",Lactobacillus murinus DSM 20452 = NBRC 14221,250,250,89%,4.00E-73,50.97,26985,NZ_AYYN01000089.1
"Caldicellulosiruptor acetigenus DSM 7040 H557DRAFT_scaffold00008.8_C, whole genome shotgun sequence",Caldicellulosiruptor acetigenus DSM 7040,250,250,90%,5.00E-73,49.03,141718,NZ_ATXO01000008.1
"Tindallia californiensis strain APO, whole genome shotgun sequence",Tindallia californiensis,250,250,89%,5.00E-73,49.41,148557,NZ_FNPV01000009.1
"Caldicellulosiruptor kristjanssonii I77R1B, complete sequence",Caldicellulosiruptor kristjanssonii I77R1B,250,250,90%,5.00E-73,49.03,2786473,NC_014721.1
"Bacillus infantis NRRL B-14911, complete sequence",Bacillus infantis NRRL B-14911,250,250,89%,5.00E-73,49.42,4884713,NC_022524.1
"Alicyclobacillus montanus strain USBA-GBX-503, whole genome shotgun sequence",Alicyclobacillus montanus,250,250,89%,5.00E-73,48.64,78064,NZ_FRAF01000015.1
"Carnobacterium gallinarum DSM 4847 strain MT44 BR43DRAFT_scf7180000000012_quiver.5_C, whole genome shotgun sequence",Carnobacterium gallinarum DSM 4847,250,250,89%,5.00E-73,49.03,3037612,NZ_JQLU01000005.1
"Cohnella abietis strain KCTC 43028 chromosome, complete genome",Cohnella abietis,250,356,89%,5.00E-73,49.03,7059027,NZ_AP019400.1
"Aminicella lysinilytica strain DSM 28287 Ga0310519_105, whole genome shotgun sequence",Aminicella lysinilytica,250,250,89%,5.00E-73,49.81,86730,NZ_SNXO01000005.1
"Clostridium massiliodielmoense strain MT26, whole genome shotgun sequence",Clostridium massiliodielmoense,250,250,90%,5.00E-73,46.72,184419,NZ_FXLO01000006.1
"Fructilactobacillus lindneri strain TMW 1.1993 chromosome, complete genome",Fructilactobacillus lindneri,250,250,89%,5.00E-73,49.22,1389742,NZ_CP014872.1
"Filibacter tadaridae isolate aTB-66, whole genome shotgun sequence",Filibacter tadaridae,250,250,90%,5.00E-73,48.06,152902,NZ_UXAV01000020.1
"Psychrobacillus insolitus strain DSM 5 Ga0215656_106, whole genome shotgun sequence",Psychrobacillus insolitus,250,250,90%,5.00E-73,47.29,165779,NZ_QKZI01000006.1
"Fructilactobacillus fructivorans strain DSM 20571 NODE_4, whole genome shotgun sequence",Fructilactobacillus fructivorans,250,250,89%,5.00E-73,50.39,128351,NZ_JQBN01000004.1
"Psychrobacillus vulpis strain Z8 scaffold8, whole genome shotgun sequence",Psychrobacillus vulpis,250,250,89%,5.00E-73,48.05,137675,NZ_VDGI01000008.1
"Fructilactobacillus fructivorans strain LF543 chromosome, complete genome",Fructilactobacillus fructivorans,250,250,89%,5.00E-73,50.39,1388767,NZ_CP045562.1
"Ligilactobacillus animalis strain P38 chromosome, complete genome",Ligilactobacillus animalis,250,250,89%,5.00E-73,50.97,1906794,NZ_CP047141.1
"Angelakisella massiliensis strain Marseille-P3217T, whole genome shotgun sequence",Angelakisella massiliensis,250,491,91%,5.00E-73,48.84,2993682,NZ_LT629945.1
"Paenibacillus swuensis strain DY6 chromosome, complete genome",Paenibacillus swuensis,250,250,89%,5.00E-73,47.86,5012599,NZ_CP011388.1
"Virgibacillus phasianinus strain LM2416 chromosome, complete genome",Virgibacillus phasianinus,250,250,89%,5.00E-73,48.64,4071214,NZ_CP022315.1
"Paenibacillus protaetiae strain FW100M-2 chromosome, complete genome",Paenibacillus protaetiae,250,250,89%,5.00E-73,49.03,4228822,NZ_CP035492.1
"Halalkalibacillus halophilus DSM 18494 G532DRAFT_scaffold00012.12_C, whole genome shotgun sequence",Halalkalibacillus halophilus DSM 18494,250,250,89%,5.00E-73,50.58,65990,NZ_AUHI01000014.1
"Bacillus niacini NBRC 15566, whole genome shotgun sequence",Bacillus niacini NBRC 15566,250,250,89%,5.00E-73,49.42,35682,NZ_BCVA01000053.1
"Bacillus terrae strain LMG 29736 Scaffold43, whole genome shotgun sequence",Bacillus terrae,250,250,89%,5.00E-73,48.83,24651,NZ_QYTW02000043.1
"Leuconostoc holzapfelii strain CCUG 54536 SS2010_7, whole genome shotgun sequence",Leuconostoc holzapfelii,250,250,90%,5.00E-73,49.81,88555,NZ_JAAXPO010000007.1
"Carnobacterium mobile DSM 4848 strain MT37L BR87DRAFT_scf7180000000018_quiver_dupTrim_8950.1_C, whole genome shotgun sequence",Carnobacterium mobile DSM 4848,250,250,89%,5.00E-73,49.03,2553405,NZ_JQMR01000001.1
"Gemella cuniculi DSM 15828 H612DRAFT_scaffold00004.4_C, whole genome shotgun sequence",Gemella cuniculi DSM 15828,250,250,90%,5.00E-73,49.42,101123,NZ_AUDW01000007.1
"Bacillus marasmi strain Marseille-P3556, whole genome shotgun sequence",Bacillus marasmi,250,250,90%,5.00E-73,48.85,47880,NZ_LR656186.1
"Anoxybacillus tepidamans strain DSM 16325 Ga0415324_03, whole genome shotgun sequence",Anoxybacillus tepidamans,250,250,90%,5.00E-73,50.19,188069,NZ_JACHEP010000003.1
"Cohnella panacarvi Gsoil 349 CohpaDRAFT_scaffold1.1, whole genome shotgun sequence",Cohnella panacarvi Gsoil 349,250,250,89%,5.00E-73,48.64,4772825,NZ_KI911563.1
"Parageobacillus thermoglucosidasius strain Wild Type chromosome, complete genome",Parageobacillus thermoglucosidasius,250,250,90%,5.00E-73,49.42,3873105,NZ_CP016622.1
"Bacillus aidingensis DSM 18341 G475DRAFT_scaffold00015.15_C, whole genome shotgun sequence",Bacillus aidingensis DSM 18341,250,250,89%,5.00E-73,48.44,92297,NZ_AUCI01000016.1
"Paenibacillus panacisoli DSM 21345 K331DRAFT_scaffold00019.19_C, whole genome shotgun sequence",Paenibacillus panacisoli DSM 21345,250,250,89%,5.00E-73,49.22,107231,NZ_AUFO01000023.1
"Enterococcus ratti strain DSM 15687 Scaffold3, whole genome shotgun sequence",Enterococcus ratti,250,250,90%,6.00E-73,47.49,170647,NZ_JXLB01000003.1
"Rummeliibacillus stabekisii strain DSM 25578 Ga0415235_04, whole genome shotgun sequence",Rummeliibacillus stabekisii,250,250,90%,6.00E-73,49.22,202370,NZ_JACHHC010000004.1
"Selenomonas infelix ATCC 43532 supercont1.2, whole genome shotgun sequence",Selenomonas infelix ATCC 43532,250,250,90%,6.00E-73,49.81,604153,NZ_JH376798.1
"Anaeromicrobium sediminis strain DY2726D Seq15, whole genome shotgun sequence",Anaeromicrobium sediminis,250,250,87%,6.00E-73,50.2,104293,NZ_NIBG01000015.1
"Lactobacillus silagei JCM 19001 strain DSM 27022 291, whole genome shotgun sequence",Lactobacillus silagei JCM 19001,250,250,89%,6.00E-73,50.2,130537,NZ_PUFJ01000008.1
"[Clostridium] dakarense strain 1, whole genome shotgun sequence",[Clostridium] dakarense,250,250,90%,6.00E-73,47.69,55334,NZ_HG529418.1
"Paenibacillus aquistagni strain 11, whole genome shotgun sequence",Paenibacillus aquistagni,250,250,89%,6.00E-73,49.03,607808,NZ_FXAZ01000003.1
"Virgibacillus oceani strain CGMCC 1.12754 sequence08, whole genome shotgun sequence",Virgibacillus oceani,250,250,89%,6.00E-73,49.03,152888,NZ_BMFR01000008.1
"Lysinibacillus macroides strain DSM 54 Scaffold5, whole genome shotgun sequence",Lysinibacillus macroides,250,250,90%,6.00E-73,48.06,332266,NZ_LGCI01000014.1
"Veillonella seminalis strain ADV4313-2 contig_0001, whole genome shotgun sequence",Veillonella seminalis,250,250,90%,6.00E-73,50,331094,NZ_RQUZ01000001.1
"Fictibacillus enclensis strain NIO-1003, whole genome shotgun sequence",Fictibacillus enclensis,250,250,90%,6.00E-73,48.08,553491,NZ_FMAV01000003.1
"Faecalimonas umbilicata strain EGH7, whole genome shotgun sequence",Faecalimonas umbilicata,250,526,90%,6.00E-73,47.1,1143966,NZ_BHEO01000002.1
"Mesobacillus campisalis strain SA2-6 scf7180000001099, whole genome shotgun sequence",Mesobacillus campisalis,250,250,89%,6.00E-73,49.42,47034,NZ_LAYY01000021.1
"Sporomusa sphaeroides DSM 2875 SPSPH_contig000002, whole genome shotgun sequence",Sporomusa sphaeroides DSM 2875,250,250,89%,6.00E-73,48.64,525353,NZ_LSLJ01000002.1
"Cohnella thailandensis strain DSM 25241 contig_6, whole genome shotgun sequence",Cohnella thailandensis,250,250,89%,6.00E-73,49.42,470746,NZ_JACJVQ010000006.1
"Weissella cryptocerci strain 26KH-42 chromosome, complete genome",Weissella cryptocerci,250,250,89%,6.00E-73,50,3020651,NZ_CP037940.1
"Thermoactinomyces daqus strain H-18 H_18_contig_14, whole genome shotgun sequence",Thermoactinomyces daqus,250,250,89%,6.00E-73,49.03,242524,NZ_JPST01000014.1
"Lysinibacillus endophyticus strain DSM 100506 NODE_21_length_54396_cov_72.997181, whole genome shotgun sequence",Lysinibacillus endophyticus,250,250,90%,6.00E-73,49.03,54396,NZ_RBZN01000021.1
"Bacillus humi strain DSM 16318 Scaffold4, whole genome shotgun sequence",Bacillus humi,250,250,89%,6.00E-73,49.42,348789,NZ_LMBW01000004.1
"Parageobacillus thermantarcticus strain M1, whole genome shotgun sequence",Parageobacillus thermantarcticus,250,250,90%,6.00E-73,49.81,126168,NZ_FOJS01000004.1
"Bacillus coahuilensis p1.1.43 ABFP000001, whole genome shotgun sequence",Bacillus coahuilensis p1.1.43,249,249,89%,6.00E-73,49.42,167032,NZ_LDYG01000001.1
"Ornithinibacillus scapharcae TW25 contig00064, whole genome shotgun sequence",Ornithinibacillus scapharcae TW25,249,249,89%,6.00E-73,49.03,58274,NZ_AEWH01000018.1
"Schaedlerella arabinosiphila strain DSM 106076 000000F_quiver_pilon, whole genome shotgun sequence",Schaedlerella arabinosiphila,249,1083,91%,6.00E-73,47.88,6346997,NZ_RHJS01000002.1
"Saccharococcus thermophilus strain DSM 4749 Ga0315738_01, whole genome shotgun sequence",Saccharococcus thermophilus,249,249,90%,6.00E-73,49.81,3063264,NZ_JAASRS010000001.1
"Lysinibacillus composti strain MCCC 1A12701 NODE_13_length_112191_cov_59.861185, whole genome shotgun sequence",Lysinibacillus composti,249,249,90%,6.00E-73,49.22,112191,NZ_RRCT01000013.1
"Paenibacillus prosopidis strain CECT 7506 Ga0244617_114, whole genome shotgun sequence",Paenibacillus prosopidis,249,249,89%,6.00E-73,50.19,187383,NZ_QPJD01000014.1
"Paenibacillus lactis 154 ctg196, whole genome shotgun sequence",Paenibacillus lactis 154,249,249,89%,6.00E-73,49.03,554509,NZ_AGIP01000003.1
"Paenibacillus ihbetae strain IHBB 9852, complete genome",Paenibacillus ihbetae,249,249,89%,6.00E-73,49.03,6593819,NZ_CP016809.1
"Syntrophobotulus glycolicus DSM 8271, complete sequence",Syntrophobotulus glycolicus DSM 8271,249,249,90%,7.00E-73,49.81,3406739,NC_015172.1
"Sporolactobacillus shoreae strain BK92 NODE_6_length_178974_cov_130.816, whole genome shotgun sequence",Sporolactobacillus shoreae,249,249,89%,7.00E-73,49.42,178974,NZ_SRJD01000006.1
"Caproiciproducens galactitolivorans strain BS-1 CAGA_contig000003, whole genome shotgun sequence",Caproiciproducens galactitolivorans,249,249,89%,7.00E-73,49.03,275481,NZ_SRMQ01000003.1
"Halobacillus locisalis strain KCTC 3788 NODE_2_length_1208651_cov_124.826, whole genome shotgun sequence",Halobacillus locisalis,249,249,89%,7.00E-73,49.03,1208651,NZ_JACEFG010000002.1
"Carnobacterium alterfunditum strain 313, whole genome shotgun sequence",Carnobacterium alterfunditum,249,249,89%,7.00E-73,48.64,2470950,NZ_FSRN01000001.1
"Ureibacillus xyleni strain JC22, whole genome shotgun sequence",Ureibacillus xyleni,249,249,90%,7.00E-73,48.65,278781,NZ_OBMQ01000005.1
"Enterococcus avium ATCC 14025 acyDI-supercont2.1, whole genome shotgun sequence",Enterococcus avium ATCC 14025,249,249,90%,7.00E-73,49.03,627492,NZ_KE136500.1
"Melissococcus plutonius strain DAT561 chromosome, complete genome",Melissococcus plutonius,249,249,89%,7.00E-73,48.64,1847807,NZ_AP018492.1
"Lysinibacillus halotolerans strain MCCC 1A12703 NODE_20_length_64545_cov_14.426860, whole genome shotgun sequence",Lysinibacillus halotolerans,249,249,90%,7.00E-73,48.84,64545,NZ_RHLQ01000020.1
"Metabacillus indicus strain DSM 16189 Contig13, whole genome shotgun sequence",Metabacillus indicus,249,249,89%,7.00E-73,50.19,273977,NZ_JNVC02000013.1
"Petroclostridium xylanilyticum strain SK-Y3 Scaffold1_18, whole genome shotgun sequence",Petroclostridium xylanilyticum,249,249,90%,7.00E-73,47.67,478887,NZ_NPML01000018.1
"Enterococcus devriesei strain DSM 22802 Scaffold12, whole genome shotgun sequence",Enterococcus devriesei,249,249,90%,7.00E-73,49.03,84147,NZ_JXKM01000012.1
"Enterococcus viikkiensis strain LMG 26075 contig3, whole genome shotgun sequence",Enterococcus viikkiensis,249,249,90%,7.00E-73,49.03,207118,NZ_BJDW01000003.1
"Paenibacillus validus NBRC 15382 PVA01S_CON000003, whole genome shotgun sequence",Paenibacillus validus NBRC 15382,249,249,89%,7.00E-73,48.64,225971,NZ_BIMH01000003.1
"Cytobacillus firmus strain IF3SW-B3 NODE_40_length_36211_cov_561.621049, whole genome shotgun sequence",Cytobacillus firmus,249,249,89%,7.00E-73,48.25,36211,NZ_JABVDD010000040.1
"Enterococcus pernyi strain Shenyang Scaffold1, whole genome shotgun sequence",Enterococcus pernyi,249,249,90%,7.00E-73,48.26,3086269,NZ_KV388085.1
"Enterococcus mundtii strain DSM 4838, complete sequence",Enterococcus mundtii,249,249,90%,7.00E-73,48.26,3357452,NZ_CP018061.1
"Carnobacterium jeotgali MS3 BP18DRAFT_scf7180000000060_quiver.7_C, whole genome shotgun sequence",Carnobacterium jeotgali MS3,249,249,89%,8.00E-73,48.64,935114,NZ_JQNF01000010.1
"Fictibacillus phosphorivorans strain G25-29 chromosome, complete genome",Fictibacillus phosphorivorans,249,249,89%,8.00E-73,48.64,4230665,NZ_CP015378.1
"Viridibacillus arenosi strain FSL R5-0213 NODE_7_length_202575_cov_4.2296, whole genome shotgun sequence",Viridibacillus arenosi,249,249,90%,8.00E-73,49.61,202575,NZ_MSPW01000007.1
"Paenibacillus phyllosphaerae strain CECT 5862 Ga0372392_05, whole genome shotgun sequence",Paenibacillus phyllosphaerae,249,249,89%,8.00E-73,49.42,492807,NZ_JACHXK010000005.1
"Bacillus wudalianchiensis strain FJAT-27215 scaffold10, whole genome shotgun sequence",Bacillus wudalianchiensis,249,249,89%,8.00E-73,49.22,168202,NZ_MAYT01000002.1
"Intestinibacillus massiliensis strain Marseille-P3216T, whole genome shotgun sequence",Intestinibacillus massiliensis,249,249,90%,8.00E-73,47.88,81080,NZ_LT707052.1
"Enterococcus pseudoavium NBRC 100491, whole genome shotgun sequence",Enterococcus pseudoavium NBRC 100491,249,249,90%,8.00E-73,49.42,62728,NZ_BCQF01000017.1
"Paenibacillus lemnae strain L7-75 Contig_1:, whole genome shotgun sequence",Paenibacillus lemnae,249,249,89%,8.00E-73,49.03,449387,NZ_JABBPN010000001.1
"Pygmaiobacter massiliensis strain Marseille-P3336, whole genome shotgun sequence",Pygmaiobacter massiliensis,249,517,90%,8.00E-73,51.16,1886982,NZ_OAML01000003.1
"Mesobacillus subterraneus strain DSM 13966 contig_33, whole genome shotgun sequence",Mesobacillus subterraneus,249,249,89%,8.00E-73,49.81,79583,NZ_RSFW01000033.1
"Parageobacillus toebii NBRC 107807, whole genome shotgun sequence",Parageobacillus toebii NBRC 107807,249,249,90%,8.00E-73,49.42,158625,NZ_BDAQ01000005.1
"Parageobacillus galactosidasius strain DSM 18751 Contig_2, whole genome shotgun sequence",Parageobacillus galactosidasius,249,249,90%,8.00E-73,49.42,2017333,NZ_NDYL01000002.1
"Gorillibacterium massiliense strain G5, whole genome shotgun sequence",Gorillibacterium massiliense,249,249,89%,8.00E-73,49.03,46983,NZ_CBQR020000103.1
"Solibacillus isronensis B3W22 contig000025, whole genome shotgun sequence",Solibacillus isronensis B3W22,249,249,90%,8.00E-73,48.45,54216,NZ_AMCK01000025.1
"Romboutsia timonensis strain Marseille-P326, whole genome shotgun sequence",Romboutsia timonensis,249,249,89%,8.00E-73,47.86,99468,NZ_LT629846.1
"Solibacillus silvestris strain DSM 12223 chromosome, complete genome",Solibacillus silvestris,249,249,90%,8.00E-73,48.45,3991226,NZ_CP014609.1
"Hydrogeniiclostidium mannosilyticum strain 1001283B150225_161107_C12 NODE_6_length_190374_cov_24.6368, whole genome shotgun sequence",Hydrogeniiclostidium mannosilyticum,249,249,90%,8.00E-73,48.84,190374,NZ_JADPHD010000006.1
"Cohnella candidum strain 18JY8-7 chromosome, complete genome",Cohnella candidum,249,249,89%,8.00E-73,48.25,5289049,NZ_CP033433.1
"Bacillus sinesaloumensis strain Marseille-P3516T, whole genome shotgun sequence",Bacillus sinesaloumensis,249,249,89%,8.00E-73,48.25,4551291,NZ_LT732529.1
"Filibacter limicola strain DSM 13886 Ga0244518_28, whole genome shotgun sequence",Filibacter limicola,249,249,90%,9.00E-73,46.9,43527,NZ_JADBEL010000028.1
"Lysinibacillus chungkukjangi strain KACC 16626 Ga0074888_103, whole genome shotgun sequence",Lysinibacillus chungkukjangi,249,249,90%,9.00E-73,47.67,234467,NZ_QJTJ01000003.1
"Fructilactobacillus sanfranciscensis strain LS451 chromosome, complete genome",Fructilactobacillus sanfranciscensis,249,249,89%,9.00E-73,48.44,1310991,NZ_CP045563.1
"Lactobacillus kimchicus JCM 15530 Scaffold8, whole genome shotgun sequence",Lactobacillus kimchicus JCM 15530,249,249,89%,9.00E-73,50.59,101126,NZ_AZCX01000008.1
"Cohnella nanjingensis strain DSM 28246 contig_46, whole genome shotgun sequence",Cohnella nanjingensis,249,249,89%,9.00E-73,49.03,78492,NZ_JACJVP010000046.1
"Paenibacillus pinistramenti strain ASL46 4, whole genome shotgun sequence",Paenibacillus pinistramenti,249,249,89%,9.00E-73,49.81,292840,NZ_VAWG01000004.1
"Lysinibacillus massiliensis 4400831 = CIP 108448 = CCUG 49529 strain 4400831 contig3, whole genome shotgun sequence",Lysinibacillus massiliensis 4400831 = CIP 108448 = CCUG 49529,249,249,90%,9.00E-73,48.06,187848,NZ_AVCZ01000003.1
"Psychrobacillus glaciei strain PB01 chromosome, complete genome",Psychrobacillus glaciei,249,314,90%,9.00E-73,47.67,4332095,NZ_CP031223.1
"Dorea longicatena strain 1001283B150210_160208_H7 NODE_14_length_71861_cov_56.1734, whole genome shotgun sequence",Dorea longicatena,249,396,90%,9.00E-73,47.49,71861,NZ_JADMOH010000014.1
"Lachnobacterium bovis DSM 14045, whole genome shotgun sequence",Lachnobacterium bovis DSM 14045,249,249,90%,9.00E-73,48.26,30762,NZ_FNPG01000031.1
"Amphibacillus jilinensis Y1 Scaffold1, whole genome shotgun sequence",Amphibacillus jilinensis Y1,249,249,89%,9.00E-73,49.42,1374356,NZ_JH976434.1
"Romboutsia lituseburensis DSM 797, whole genome shotgun sequence",Romboutsia lituseburensis DSM 797,249,249,90%,9.00E-73,47.31,34686,NZ_FNGW01000015.1
"Desulfotomaculum copahuensis strain LMa1 LMA27_trimmed_contig_89, whole genome shotgun sequence",Desulfotomaculum copahuensis,249,249,89%,9.00E-73,49.42,12227,NZ_LYVF01000196.1
"Christensenella timonensis strain Marseille-P2437T, whole genome shotgun sequence",Christensenella timonensis,249,393,89%,9.00E-73,48.64,2314156,NZ_FLKP01000002.1
